id,name,price,category,sku,multi pack,image,url,product,rsp,brand,size,product_code,Retail Ean,vat_rate,description,description_bullets,ingredients_description,other_info,cleaned_name,original_name,multipack,is_multipack,slug
826719-1,CocaCola Original Taste 6 x 1.75L PM 2.79,8.99,Grocery > Soft Drinks > 1 and 1.5 Ltr Bottles,826719.0,1.75Ltr × 6 × 1,https://www.bestwaywholesale.co.uk/img/products/250/7/5017726449377.jpg,https://www.bestwaywholesale.co.uk/product/826719-1,Sparkling Soft Drink with Plant Extracts,£2.79,Coca-Cola,1.75Ltr,826719.0,5000112684278.0,Standard,"First created in 1886, Coca-Cola Original Taste is the legendary flavoured sparkling soft drink. Everything about Coca-Cola is unique; from its iconic flavour to the famous bottle. This all-time classic with a crisp and unique flavour. But it's not only about the great taste. Coca-Cola is so much more.","['A truly unique & great taste', ""The world's favourite soft drink"", 'Coca-Cola Original Taste, made for sharing', 'Sparkling soft drink', 'Happiness, bottled', 'Flavoured drink', 'Carbonated beverage', 'Great taste', 'Can of coke', 'Delicious and refreshing', 'GMO free', 'Added Colours', 'No Natural Flavourings', 'No Added Preservatives', 'No Quinine', 'No Intense Sweetners', 'Suitable for vegetarians', 'Suitable for vegans']","Carbonated Water, Sugar, Colour (Caramel E150d), Acid (Phosphoric Acid), Natural Flavourings, Caffeine Flavouring","['Free From Celery', 'Free From Cereals Containing Gluten', 'Free From Crustaceans', 'Free From Eggs', 'Free From Fish', 'Free From Lupin', 'Free From Milk', 'Free From Molluscs', 'Free From Mustard', 'Free From Nuts', 'Free From Peanuts', 'Free From Rye', 'Free From Sulphur Dioxide/Sulphites', 'Free From Wheat', 'Free From Barley', 'Free From Oats', 'Free From Soya', 'Free From Sesame', 'Free From Genetically Modified Ingredients', 'Pack Type: Wrap']",Cocacola Original Taste,CocaCola Original Taste 6 x 1.75L PM 2.79,"{'count': 6, 'size': 1.75, 'unit': 'l', 'format': '6x1.75l'}",True,cocacola-original-taste
612484-1,Evian Still Natural Mineral Water 1.5L,5.39,Grocery > Soft Drinks > Still Water,612484.0,1.5Ltr × 8 × 1,https://www.bestwaywholesale.co.uk/img/products/250/2/3068320084602.jpg,https://www.bestwaywholesale.co.uk/product/612484-1,612484,£1.39,Evian,1.5Ltr,612484.0,3068320084602.0,Standard,"Enjoy mountain made minerals from Alpine glacial rocks, evian natural mineral water:",[],,"['Country of Origin France', 'Recycling Info: Recycle Pack', ""100% recycled - Cap and label don't yet contain recycled plastic"", 'This bottle is made from 100% recycled plastic so the colour of the bottle may vary', '100% recyclable', 'Recycled Plastic - This bottle is made from 100% recycled plastic and has been certified as carbon neutral', 'Please recycle this bottle', 'Lid On - Widely Recycled']",Evian Still Natural Mineral Water,Evian Still Natural Mineral Water 1.5L,,False,evian-still-natural-mineral-water
826005-1,Ribena Blackcurrant Juice Drink 500ml PMP 1.35,7.89,Grocery > Soft Drinks > Small Bottles,826005.0,500ml × 12 × 1,https://www.bestwaywholesale.co.uk/img/products/250/2/5054267015432.jpg,https://www.bestwaywholesale.co.uk/product/826005-1,Blackcurrant Juice Drink with sugar and sweeteners,£1.35,Ribena,500ml,826005.0,5054267015432.0,Standard,"Lovely juicy blackcurrant make up our delightfully fruity juice drink. It's rich in vitamin C, has no artificial colours, making it perfect for the whole family.REAL FRUIT JUICES - Lovely juicy blackcurrant make up our delightfully fruity juice drink. It's rich in vitamin C, has no artificial colours or flavours, making it perfect for the whole family.BLACKCURRANT REFRESHMENT - The Ribena flavour that everyone knows and loves in a ready to serve juice drink. Perfect for drinking at home or on the go. Best served chilled.ON THE GO - The perfect pairing for a BBQ or picnic in the park on a hot summer's day! Best served chilled.ECO-CONSCIOUS - All our Ribena Juice Drink bottles are made from 100% recycled plastic* & have been designed for bottle-to-bottle recycling, so that every bottle we sell can start a new life as another bottle!*Cap and label not made from recycled content yet, but are recyclable.BRITISH HERITAGE - Since 1938 we've been working with British farms, the birds and the bees to grow juicy blackcurrants. We harvest our blackcurrants at their freshest, to ensure every glass of Ribena is deliciously fruity.",['Fruit juice from concentrate'],"Water, Blackcurrant Juice from Concentrate (6%), Sugar, Acidity Regulator (Sodium Gluconate), Thickener (Polydextrose), Vitamin C, Extracts of Carrot and Hibiscus, Natural Blackcurrant Flavourings, Acid (Citric Acid), Sweeteners (Acesulfame K, Sucralose).","['Country of Origin United Kingdom', 'Pack Type: Plastic Bottle']",Ribena Blackcurrant Juice Drink,Ribena Blackcurrant Juice Drink 500ml PMP 1.35,,False,ribena-blackcurrant-juice-drink
823257-1,Hell Classic PM 1.00,6.29,Grocery > Soft Drinks > Energy and Health Drinks,823257.0,500ml × 12 × 1,https://www.bestwaywholesale.co.uk/img/products/full/upl/823257.jpg,https://www.bestwaywholesale.co.uk/product/823257-1,823257,£1.00,,500ml,823257.0,5999571054664.0,Standard,,[],,[],Hell Classic,Hell Classic PM 1.00,,False,hell-classic
827755-1,Monster Energy Drink Lando Norris Zero Sugar 12 x 500ml PM 1.65,9.89,Grocery > Soft Drinks > Energy and Health Drinks,827755.0,500ml × 12 × 1,https://www.bestwaywholesale.co.uk/img/products/250/3/5056784906453.jpg,https://www.bestwaywholesale.co.uk/product/827755-1,"Carbonated Energy Drink With Taurine, Ginseng, Caffeine, L?carnitine and B Vitamins with Sweetener.",£1.65,Monster Energy,500ml,827755.0,5056784906446.0,Standard,"Multiple Formula 1 race winner Lando Norris spends his weekends racing 230mph spaceships, and this zero?sugar Monster drink tastes exactly how you'd imagine that feels. You'll be won over with the freshest of flavours, and this can is wrapped in the same iconic helmet design he races on track. It's the taste of the future, packed into one can. Watch your back - the new era is here, and it's tasting good",[],"Carbonated Water, Flavour Enhancer (Erythritol), Acid (Citric Acid), Taurine (0.4%), Acidity Regulator (Sodium Citrates), Flavourings, Panax Ginseng Root Extract (0.08%), Preservatives (Potassium Sorbate, Sodium Benzoate), Caffeine (0.03%), Sweetener (Sucralose), L-Carnitine L-Tartrate (0.02%), Vitamins (B3, B6, B2, B12), Stabiliser (Glycerol Esters of Wood Rosins), Guarana Seed Extract (0.002%), Inositol","['Free From Celery', 'Free From Cereals Containing Gluten', 'Free From Crustaceans', 'Free From Eggs', 'Free From Fish', 'Free From Lupin', 'Free From Milk', 'Free From Molluscs', 'Free From Mustard', 'Free From Nuts', 'Free From Peanuts', 'Free From Sulphur Dioxide/Sulphites', 'Free From Soya', 'Free From Sesame', 'Contains Sweeteners', 'Recycling Info: Recycle Pack', 'Pack Type: Can']",Monster Energy Drink Lando Norris Zero Sugar,Monster Energy Drink Lando Norris Zero Sugar 12 x 500ml PM 1.65,"{'count': 12, 'size': 500.0, 'unit': 'ml', 'format': '12x500ml'}",True,monster-energy-drink-lando-norris-zero-sugar
826027-1,Red Bull Energy Drink 355ml 24 Pack PM 2.10,30.49,Grocery > Soft Drinks > Energy and Health Drinks,826027.0,355ml × 24 × 1,https://www.bestwaywholesale.co.uk/img/products/250/7/9002490280307.jpg,https://www.bestwaywholesale.co.uk/product/826027-1,826027,£2.10,Red Bull,355ml,826027.0,9002490280307.0,Standard,Niacin and vitamin B6 contribute to the reduction of tiredness and fatigue as well as to normal energy-yielding metabolism.,"['With taurine', 'Vitalizes body and mind®', 'Pasteurised']","Water, Sucrose, Glucose, Acid (Citric Acid), Carbon Dioxide, Taurine (0.4%), Acidity Regulators (Sodium Carbonates, Magnesium Carbonates), Caffeine (0.03%), Vitamins (Niacin, Pantothenic Acid, B6, B12), Flavourings, Colours (Plain Caramel, Riboflavins)",['Pack Type: Can'],Red Bull Energy Drink 24,Red Bull Energy Drink 355ml 24 Pack PM 2.10,"{'count': 24, 'size': None, 'unit': None, 'format': '24pk'}",True,red-bull-energy-drink-24
823182-1,Hell Energy Drink Straw and Banana 1 1X12X500ml,6.29,Grocery > Soft Drinks > Energy and Health Drinks,823182.0,500ml × 12 × 1,https://www.bestwaywholesale.co.uk/img/products/full/upl/823182.jpg,https://www.bestwaywholesale.co.uk/product/823182-1,823182,£1.00,,500ml,823182.0,5999571054640.0,Standard,,[],,[],Hell Energy Drink Straw and Banana 1 1x,Hell Energy Drink Straw and Banana 1 1X12X500ml,"{'count': 12, 'size': 500.0, 'unit': 'ml', 'format': '12x500ml'}",True,hell-energy-drink-straw-and-banana-1-1x
811405-1,Schweppes Lemonade 6 x 2L PMP 1.75,5.99,Grocery > Soft Drinks > 2 and 3 Ltr Bottles,811405.0,2Ltr × 6 × 1,https://www.bestwaywholesale.co.uk/img/products/250/5/5017726432225.jpg,https://www.bestwaywholesale.co.uk/product/811405-1,Sparkling Lemon Flavour Soft Drink with Sugar and Sweeteners,£1.75,Schweppes,2Ltr,811405.0,5000112557329.0,Standard,"Try out Schweppes Lemonade, a unique sparkling soft drink inspired by the original Schweppes Aerated Lemonade from 1835. Enjoy the classic, crisp lemon taste and refreshing bubbles while at a party or relaxing at home. Drink it straight or mix it with your favourite spirit to make your own tasty cocktail. Delicious and refreshing, serve ice cold for maximum enjoyment. Please recycle.","['Masterfully made with Lemon Juice', 'Original', 'This product is GMO free', 'This product is gluten free', 'This product is allergen free', 'This product is suitable for vegetarians/vegans']","Carbonated Water, Sugar, Lemon Juice from Concentrate (2%), Acid (Citric Acid), Flavourings, Acidity Regulator (Sodium Citrates), Sweeteners (Aspartame, Sodium Saccharin), Preservative (Potassium Sorbate), Antioxidant (Ascorbic Acid)","['Free From Celery', 'Free From Cereals Containing Gluten', 'Free From Crustaceans', 'Free From Eggs', 'Free From Fish', 'Free From Lupin', 'Free From Milk', 'Free From Molluscs', 'Free From Mustard', 'Free From Nuts', 'Free From Peanuts', 'Free From Sulphur Dioxide/Sulphites', 'Free From Soya', 'Free From Sesame', 'Free From Genetically Modified Ingredients', 'Contains Sweeteners', 'Proudly Bottled in Great Britain', 'Pack Type: Wrap']",Schweppes Lemonade,Schweppes Lemonade 6 x 2L PMP 1.75,"{'count': 6, 'size': 2.0, 'unit': 'l', 'format': '6x2l'}",True,schweppes-lemonade
823179-1,Hell Energy Drink Black Cherry 1 1X12X500ml,6.29,Grocery > Soft Drinks > Energy and Health Drinks,823179.0,500ml × 12 × 1,https://www.bestwaywholesale.co.uk/img/products/full/upl/823179.jpg,https://www.bestwaywholesale.co.uk/product/823179-1,823179,£1.00,,500ml,823179.0,5999571054602.0,Standard,,[],,[],Hell Energy Drink Black Cherry 1 1x,Hell Energy Drink Black Cherry 1 1X12X500ml,"{'count': 12, 'size': 500.0, 'unit': 'ml', 'format': '12x500ml'}",True,hell-energy-drink-black-cherry-1-1x
820581-1,Lucozade Sport Drink Orange 500ml PMP 1.50,10.75,Grocery > Soft Drinks > Energy and Health Drinks,820581.0,500ml × 12 × 1,https://www.bestwaywholesale.co.uk/img/products/250/5/5054267014695.jpg,https://www.bestwaywholesale.co.uk/product/820581-1,Orange Flavour Isotonic Drink with Sugars and Sweeteners,£1.50,Lucozade,500ml,820581.0,5054267014695.0,Standard,Fuels Performance - Lucozade Sport provides ~16g of carbohydrate per 250ml serving and electrolytes to help maintain performance during prolonged endurance exercise.,['Lucozade Sport Orange is an isotonic sports drink which provides carbohydrates and electrolytes to enhance hydration and help maintain performance during prolonged endurance exercise. The perfect performance partner.'],"Water, Glucose Syrup, Acid (Citric Acid), Acidity Regulator (Sodium Citrate), Preservative (Potassium Sorbate), Stabiliser (Acacia Gum), Antioxidant (Ascorbic Acid), Sweeteners (Aspartame, Acesulfame K), Flavouring, Niacin (Vitamin B3), Colour (Beta Carotene)","['Free From Artificial Colours', 'Recycling Info: Plastic - Widely Recycled Bottle', 'Recycle me!', 'Pack Type: Plastic Bottle']",Lucozade Sport Drink Orange,Lucozade Sport Drink Orange 500ml PMP 1.50,,False,lucozade-sport-drink-orange
824427-1,Monster Energy Drink 500ml PM 1.75,10.69,Grocery > Soft Drinks > Energy and Health Drinks,824427.0,500ml × 12 × 1,https://www.bestwaywholesale.co.uk/img/products/250/4/5061013949644.jpg,https://www.bestwaywholesale.co.uk/product/824427-1,"Carbonated Energy Drink with Taurine, Ginseng, L-Carnitine, Caffeine and B Vitamins with Sugars and Sweetener.",£1.75,Monster,500ml,824427.0,5061013949644.0,Standard,"Tear into a can of Monster Energy, the meanest energy drink on the planet.The Monster Energy blend combined with caffeine gives you the energy you need in a smooth easy drinking taste. Taurine, L-carnitine, ginseng, caffeine, and B vitamins will give you the energy you need at any point in your day.","['This product is GMO free', 'This product is gluten free', 'This product is allergen free']","Carbonated Water, Sucrose, Glucose Syrup, Acid (Citric Acid), Flavourings, Taurine (0.4%), Acidity Regulator (Sodium Citrates), Panax Ginseng Root Extract (0.08%), L-Carnitine L-Tartrate (0.04%), Preservatives (Sorbic Acid, Benzoic Acid), Caffeine (0.03%), Colour (Anthocyanins), Vitamins (B3, B6, B2, B12), Sweetener (Sucralose), Sodium Chloride, D-Glucuronolactone, Guarana Seed Extract (0.002%), Inositol, Maltodextrin","['Free From Celery', 'Free From Cereals Containing Gluten', 'Free From Crustaceans', 'Free From Eggs', 'Free From Fish', 'Free From Lupin', 'Free From Milk', 'Free From Molluscs', 'Free From Mustard', 'Free From Nuts', 'Free From Peanuts', 'Free From Sulphur Dioxide/Sulphites', 'Free From Soya', 'Free From Sesame', 'Free From Genetically Modified Ingredients', 'Contains Sweeteners', 'Recycling Info: Recycle Pack', 'Deposit return 20p', 'This multipart is registered for sale Scotland. Empty cans within are redeemable for deposite retrun in Scotland', 'Pack Type: Can']",Monster Energy Drink,Monster Energy Drink 500ml PM 1.75,,False,monster-energy-drink
824542-1,Monster Energy Drink Ultra Zero Sugar 500ml PM 1.65,9.69,Grocery > Soft Drinks > Energy and Health Drinks,824542.0,500ml × 12 × 1,https://www.bestwaywholesale.co.uk/img/products/250/5/5061013949675.jpg,https://www.bestwaywholesale.co.uk/product/824542-1,"Carbonated Energy Drink with Taurine, Ginseng, Caffeine, L-Carnitine and B Vitamins with Sweeteners.",£1.65,Monster Energy,500ml,824542.0,5061013949675.0,Standard,"Some people are impossible to please. As soon as they get what they thought they wanted they always want more. Our team riders and Monster Girls are no different….. they've been dropping some hints lately.They've been asking us for a new Monster drink. A little less sweet, lighter-tasting and zero calories, but with a full load of our Monster energy blend.Sure, white is the new black. We went all out: Monster Energy Ultra","['This product is GMO free', 'This product is gluten free', 'This product is allergen free', 'Taurine + Zero Sugar + L-Carnitine', 'This product is suitable for vegetarians/vegans']","Carbonated Water, Acid (Citric Acid), Taurine (0.4%), Acidity Regulator (Sodium Citrates), Flavourings, Panax Ginseng Root Extract (0.08%), Sweeteners (Sucralose, Acesulfame K), Preservatives (Sorbic Acid, Benzoic Acid), Caffeine (0.03%), L-Carnitine L-Tartrate (0.015%), Vitamins (B3, B5, B6, B12), Sodium Chloride, D-Glucuronolactone, Guarana Seed Extract (0.002%), Inositol","['Free From Celery', 'Free From Cereals Containing Gluten', 'Free From Crustaceans', 'Free From Eggs', 'Free From Fish', 'Free From Lupin', 'Free From Milk', 'Free From Molluscs', 'Free From Mustard', 'Free From Nuts', 'Free From Peanuts', 'Free From Sulphur Dioxide/Sulphites', 'Free From Sesame', 'Free From Genetically Modified Ingredients', 'Contains Sweeteners', 'Recycling Info: Recycle Pack', 'Drposite return 20p', 'Pack Type: Can']",Monster Energy Drink Ultra Zero Sugar,Monster Energy Drink Ultra Zero Sugar 500ml PM 1.65,,False,monster-energy-drink-ultra-zero-sugar
827325-1,Red Bull The Winter Edition Iced Vanilla Berry Energy Drink 250ml,9.89,Grocery > Soft Drinks > Energy and Health Drinks,827325.0,250ml × 12 × 1,https://www.bestwaywholesale.co.uk/img/products/250/6/9002490284886.jpg,https://www.bestwaywholesale.co.uk/product/827325-1,Energy Drink with the taste of Iced Vanilla Berry,£1.65,Red Bull,250ml,827325.0,9002490284886.0,Standard,Niacin and vitamin B6 contribute to the reduction of tiredness and fatigue as well as to normal energy-yielding metabolism.,"['Vitalizes body and mind®', 'Pasteurised']","Water, Sucrose, Glucose, Acid (Citric Acid), Carbon Dioxide, Taurine (0.4%), Acidity Regulator (Sodium Citrates), Caffeine (0.03%), Vitamins (Niacin, Pantothenic Acid, B6, B12), Flavourings, Colour (Brilliant Blue FCF)",['Pack Type: Can'],Red Bull the Winter Edition Iced Vanilla Berry Energy Drink,Red Bull The Winter Edition Iced Vanilla Berry Energy Drink 250ml,,False,red-bull-the-winter-edition-iced-vanilla-berry-energy-drink
824424-1,Monster Energy Drink Pipeline Punch 500ml PM 1.75,10.69,Grocery > Soft Drinks > Energy and Health Drinks,824424.0,500ml × 12 × 1,https://www.bestwaywholesale.co.uk/img/products/250/8/5056784900338.jpg,https://www.bestwaywholesale.co.uk/product/824424-1,"Carbonated Energy Drink with 6% Fruit Juice from Fruit Juice Concentrate, Taurine, Caffeine, L-Carnitine and B Vitamins with Sugars and Sweetener",£1.75,Monster,500ml,824424.0,5056784900338.0,Standard,"Banzai Pipeline, the world's most famous wave, on Oahu's fabled North Shore comes alive for just a few brief months every winter. In honour of this epic force of nature, we created Monster Pipeline Punch.","['This product is GMO free', 'This product is gluten free', 'This product is allergen free']","Carbonated Water, Fruit Juices from Concentrate (6%) (Orange, Apple, Guava, Pineapple, Passion Fruit), Sucrose, Glucose Syrup, Taurine (0.4%), Acid (Citric Acid), Maltodextrin, Flavourings, Acidity Regulator (Sodium Citrates), Preservatives (Potassium Sorbate, Sodium Benzoate), Caffeine (0.03%), Vegetable Oils (Coconut, Rapeseed), Sweetener (Sucralose), Modified Starch, Vitamins (B3, B6, B2, B12), L-Carnitine L-Tartrate (0.004%), Sodium Chloride, Inositol, Colour (E129)","['Free From Celery', 'Free From Cereals Containing Gluten', 'Free From Crustaceans', 'Free From Eggs', 'Free From Fish', 'Free From Lupin', 'Free From Milk', 'Free From Molluscs', 'Free From Mustard', 'Free From Nuts', 'Free From Peanuts', 'Free From Sulphur Dioxide/Sulphites', 'Free From Soya', 'Free From Sesame', 'Free From Genetically Modified Ingredients', 'Contains Sweeteners', 'Recycling Info: Recycle Pack', 'Pack Type: Can']",Monster Energy Drink Pipeline Punch,Monster Energy Drink Pipeline Punch 500ml PM 1.75,,False,monster-energy-drink-pipeline-punch
824417-1,Monster Energy Drink Mango Loco 500ml PM 1.75,10.69,Grocery > Soft Drinks > Energy and Health Drinks,824417.0,500ml × 12 × 1,https://www.bestwaywholesale.co.uk/img/products/250/1/5056784900031.jpg,https://www.bestwaywholesale.co.uk/product/824417-1,"Carbonated Energy Drink with 9% Fruit Juice from Fruit Juice Concentrate, Taurine, Caffeine, L-Carnitine and B Vitamins, with Sugars and Sweetener",£1.75,Monster,500ml,824417.0,5056784900031.0,Standard,"Following Halloween each year friends and family gather to celebrate “Dia de Los Muertos”. Marigolds, mysticism and memories combined with food and drink entice the souls of the departed to join the party.Mango Loco is a heavenly blend of exotic juices certain to attract even the most stubborn spirit.Crazy good taste with just enough of that Monster magic to keep the party going for days….Unleash the Beast! ®","['L-Carnitine + Taurine + B Vitamins', 'This product is allergen free', 'This product is GMO free', 'This product is gluten free', 'This product is suitable for vegetarians']","Carbonated Water, Fruit Juice from Concentrates (9%) (White Grape, Mango, Guava, Apple, Pineapple, Passion Fruit, Apricot, Peach, Orange, Lemon), Sucrose, Glucose Syrup, Acids (Citric Acid, Malic Acid), Taurine (0.4%), Flavourings, Acidity Regulators (Potassium Citrates, Sodium Citrates), Preservatives (Potassium Sorbate, Sodium Benzoate), Caffeine (0.03%), Colour (Carotenes), Sweetener (Sucralose), Vitamins (B3, B6, B2, B12), Stabilisers (Xanthan Gum, Sodium Alginate, Gum Arabic), L-Carnitine L-Tartrate (0.004%), Inositol, Fruit and Vegetable Concentrates (Grape, Carrot and Sweet Potato)","['Free From Celery', 'Free From Cereals Containing Gluten', 'Free From Crustaceans', 'Free From Eggs', 'Free From Fish', 'Free From Lupin', 'Free From Milk', 'Free From Molluscs', 'Free From Mustard', 'Free From Nuts', 'Free From Peanuts', 'Free From Sulphur Dioxide/Sulphites', 'Free From Soya', 'Free From Sesame', 'Free From Genetically Modified Ingredients', 'Contains Sweeteners', 'Recycling Info: Recycle Pack', 'Pack Type: Can']",Monster Energy Drink Mango Loco,Monster Energy Drink Mango Loco 500ml PM 1.75,,False,monster-energy-drink-mango-loco
831142-1,Pepsi Max No Sugar Cola PMP Bottle 2L ,7.49,Grocery > Soft Drinks > 2 and 3 Ltr Bottles,831142.0,2Ltr × 6 × 1,https://www.bestwaywholesale.co.uk/img/products/250/9/4062139024759.jpg,https://www.bestwaywholesale.co.uk/product/831142-1,Carbonated Low Calorie Cola Flavoured Soft Drink with Sweeteners,£2.19,Pepsi,2Ltr,831142.0,4062139024742.0,Standard,"Product composition varies in the EU, visit www.info.pepsico.eu for details.","['Maximum Taste', 'No Sugar']","Carbonated Water, Colour (E150d), Sweeteners (Aspartame, Acesulfame K), Acids (Phosphoric Acid, Citric Acid), Flavourings (including Caffeine), Preservative (Potassium Sorbate)","['Contains Sweeteners', 'Recycling Info: Recycle Pack', 'Pack Type: Bottle']",Pepsi Max No Sugar Cola Pmp,Pepsi Max No Sugar Cola PMP Bottle 2L ,,False,pepsi-max-no-sugar-cola-pmp
826028-1,Red Bull Energy Drink 473ml 12 Pack PM 2.65,19.79,Grocery > Soft Drinks > Energy and Health Drinks,826028.0,473ml × 12 × 1,https://www.bestwaywholesale.co.uk/img/products/250/0/90474040.jpg,https://www.bestwaywholesale.co.uk/product/826028-1,Energy Drink,£2.65,Red Bull,473ml,826028.0,9002490280338.0,Standard,Niacin and vitamin B6 contribute to the reduction of tiredness and fatigue as well as to normal energy-yielding metabolism.,"['With taurine', 'Vitalizes body and mind®', 'Pasteurised']","Water, Sucrose, Glucose, Acid (Citric Acid), Carbon Dioxide, Taurine (0.4%), Acidity Regulators (Sodium Carbonates, Magnesium Carbonates), Caffeine (0.03%), Vitamins (Niacin, Pantothenic Acid, B6, B12), Flavourings, Colours (Plain Caramel, Riboflavins)",['Pack Type: Can'],Red Bull Energy Drink 12,Red Bull Energy Drink 473ml 12 Pack PM 2.65,"{'count': 12, 'size': None, 'unit': None, 'format': '12pk'}",True,red-bull-energy-drink-12
826026-1,Red Bull Energy Drink 250ml 24 Pack PM 1.65,22.29,Grocery > Soft Drinks > Energy and Health Drinks,826026.0,250ml × 24 × 1,https://www.bestwaywholesale.co.uk/img/products/250/4/9002490280284.jpg,https://www.bestwaywholesale.co.uk/product/826026-1,826026,£1.65,Red Bull,250ml,826026.0,9002490280284.0,Standard,Niacin and vitamin B6 contribute to the reduction of tiredness and fatigue as well as to normal energy-yielding metabolism.,"['With Taurine', 'Vitalizes body and mind®', 'Pasteurised']","Water, Sucrose, Glucose, Acid (Citric Acid), Carbon Dioxide, Taurine (0.4%), Acidity Regulators (Sodium Carbonates, Magnesium Carbonates), Caffeine (0.03%), Vitamins (Niacin, Pantothenic Acid, B6, B12), Flavourings, Colours (Plain Caramel, Riboflavins)",['Pack Type: Can'],Red Bull Energy Drink 24,Red Bull Energy Drink 250ml 24 Pack PM 1.65,"{'count': 24, 'size': None, 'unit': None, 'format': '24pk'}",True,red-bull-energy-drink-24
769044-1,Relentless Origin Energy Drink 500ml PMP 1,6.12,Grocery > Soft Drinks > Energy and Health Drinks,769044.0,500ml × 12 × 1,https://www.bestwaywholesale.co.uk/img/products/250/6/5060466510296.jpg,https://www.bestwaywholesale.co.uk/product/769044-1,"Carbonated Energy Drink with Taurine, Caffeine, Guarana and B Vitamins with Sugar and Sweetener.",£1.00,Relentless,500ml,769044.0,5017726170240.0,Standard,"The journey towards artistry and committing everything for your moment is an accolade in itself. Greatness or glory doesn't come by accident, it is earned.",[],"Carbonated Water, Sucrose, Acid (Citric Acid), Flavour Enhancer (Erythritol), Taurine (0.4%), Acidity Regulator (Sodium Citrates), Preservatives (Potassium Sorbate, Sodium Benzoate), Colour (E150d), Caffeine (0.03%), Flavourings, Sweetener (Sucralose), Vitamins (B3, B5, B6, B12), Guarana Seed Extract (0.005%)","['Free From Celery', 'Free From Cereals Containing Gluten', 'Free From Crustaceans', 'Free From Eggs', 'Free From Fish', 'Free From Lupin', 'Free From Milk', 'Free From Molluscs', 'Free From Mustard', 'Free From Nuts', 'Free From Peanuts', 'Free From Sulphur Dioxide/Sulphites', 'Free From Soya', 'Free From Sesame', 'Contains Sweeteners', 'Recycling Info: Recycle Pack', 'Pack Type: Can']",Relentless Origin Energy Drink,Relentless Origin Energy Drink 500ml PMP 1,,False,relentless-origin-energy-drink
