id,name,price,category,sku,multi pack,image,url,product,rsp,brand,size,product_code,Retail Ean,vat_rate,description,description_bullets,ingredients_description,other_info,cleaned_name,original_name,multipack,is_multipack,slug
824418-1,Monster Energy Drink Monarch 500ml PM 1.75,10.69,Grocery > Soft Drinks > Energy and Health Drinks,824418.0,500ml × 12 × 1,https://www.bestwaywholesale.co.uk/img/products/250/8/5061013949828.jpg,https://www.bestwaywholesale.co.uk/product/824418-1,"Carbonated Energy Drink with 5% Fruit Juice from Fruit Juice Concentrate, Taurine, Caffeine, L-Carnitine and B Vitamins with Sugars and Sweetener.",£1.75,Monster,500ml,824418.0,5061013949828.0,Standard,There's this theory that something as small and inconsequential as the flapping of a butterfly's wings can be the trigger that results in a hurricane. Monster Monarch named for the humble butterfly has a light subtle flavour with hints of peach and nectarine. You could say it's delicate and not too overpowering but get ready to experience your own “Butterfly Effect” as Monarch has a full load of the legendary Monster Energy blend.,"['B-VITAMINS + TAURINE + L-CARNITINE', 'This product is GMO free', 'This product is allergen free', 'This product is gluten free']","Carbonated Water, Sucrose, Fruit Juices from Concentrate (5%) (Apple, Peach, Pear, Pineapple, Nectarine, Mango, Banana), Glucose Syrup, Acid (Citric Acid), Taurine (0.4%), Acidity Regulator (Sodium Citrates), Flavourings, Maltodextrin, Preservative (Potassium Sorbate), Caffeine (0.03%), Vegetable Oils (Coconut, Rapeseed), Modified Starch, Vitamins (B3, B6, B2, B12), Sweetener (Sucralose), L-Carnitine L-Tartrate (0.004%), Sodium Chloride, Inositol, Colour (E129)","['Free From Celery', 'Free From Cereals Containing Gluten', 'Free From Crustaceans', 'Free From Eggs', 'Free From Fish', 'Free From Lupin', 'Free From Milk', 'Free From Molluscs', 'Free From Mustard', 'Free From Nuts', 'Free From Peanuts', 'Free From Sulphur Dioxide/Sulphites', 'Free From Soya', 'Free From Sesame', 'Free From Genetically Modified Ingredients', 'Contains Sweeteners', 'Recycling Info: Recycle Pack', 'Pack Type: Can']",Monster Energy Drink Monarch,Monster Energy Drink Monarch 500ml PM 1.75,,False,monster-energy-drink-monarch
812171-1,Lucozade Energy Drink Orange 900ml PMP 2,13.79,Grocery > Soft Drinks > Energy and Health Drinks,812171.0,900ml × 12 × 1,https://www.bestwaywholesale.co.uk/img/products/250/0/5054267013070.jpg,https://www.bestwaywholesale.co.uk/product/812171-1,Sparkling Orange Glucose Drink with sugars and sweeteners,£2.00,Lucozade,900ml,812171.0,5054267013070.0,Standard,"As well as tasting great, we also try to do great things to ensure we're doing our bit for a sustainable future! All of our bottles are fitted with our new 60% transparent sleeve. This gives all our recyclable products the best chance of being turned back into bottles and used again!","['Bursting with orange citrus flavour, Lucozade Orange 900ml is refreshing and zesty!', 'Our refreshing Lucozade Energy is bursting with sparkling flavour. With Glucose and Vitamin B3 to help reduce tiredness, Lucozade Energy helps you get through your day!', 'Best enjoyed cold.']","Carbonated Water, Glucose Syrup (11%), Orange Juice from Concentrate (6%), Acid (Citric Acid), Acidity Regulator (Sodium Gluconate), Flavourings, Preservative (Potassium Sorbate), Sweeteners (Acesulfame K, Sucralose), Stabiliser (Acacia Gum), Caffeine, Antioxidant (Ascorbic Acid), Niacin (Vitamin B3), Colour (Beta Carotene)","['Contains Sweeteners', 'Recycling Info: Plastic - Widely Recycled Bottle', 'Pack Type: Plastic Bottle']",Lucozade Energy Drink Orange,Lucozade Energy Drink Orange 900ml PMP 2,,False,lucozade-energy-drink-orange
823311-1,Monster Rio Punch 500ml,10.69,Grocery > Soft Drinks > Energy and Health Drinks,823311.0,500ml × 12 × 1,https://www.bestwaywholesale.co.uk/img/products/250/0/5056784900420.jpg,https://www.bestwaywholesale.co.uk/product/823311-1,"Carbonated Energy Drink with 2% Fruit Juice from Fruit Juice Concentrate, Containing Taurine, Ginseng, Caffeine, L-Carnitine and B Vitamins with Sugars and Sweetener.",£1.75,Monster,500ml,823311.0,5056784900420.0,Standard,"It's a blend of exotic fruit flavours with a hint of spice, that's fully loaded with our world-famous monster energy blend.From the shore of Copacabana Beach to the top of Sugarloaf Mountain, Rio Punch will have you partying into the night.","['Vitamins + Taurine', 'Carnitine + B', 'Punch + Energy']","Carbonated Water, Sucrose, Fruit Juices from Concentrate (2%) (Apple, White Grape, Papaya, Mango), Glucose Syrup, Taurine (0.4%), Acids (Citric Acid, Malic Acid), Flavourings, Acidity Regulator (Sodium Citrates), Panax Ginseng Root Extract (0.08%), Caffeine (0.03%), Preservative (Potassium Sorbate), Sweetener (Sucralose), Vitamins (B3, B6, B2, B12), Stabiliser (Glycerol Esters of Wood Rosins), Maltodextrin, L-Carnitine L-Tartrate (0.004%), Inositol, Colour (E129)","['Contains Sweeteners', 'Recycling Info: Certified as Recyclable Can', 'Deposit is Redeemable on Empty Undamaged Cans Purchased in the Republic of Ireland Only', 'Pack Type: Can']",Monster Rio Punch,Monster Rio Punch 500ml,,False,monster-rio-punch
111366-1,Volvic Touch of Fruit Low Sugar Strawberry Natural Flavoured Water 6 x 1.5L,4.79,Grocery > Soft Drinks > Flavoured Water,111366.0,1.5Ltr × 6 × 1,https://www.bestwaywholesale.co.uk/img/products/250/3/3057640410123.jpg,https://www.bestwaywholesale.co.uk/product/111366-1,"Still natural mineral water drink with natural flavourings, sugar and sweetener.",£1.89,Volvic,1.5Ltr,111366.0,3057640372858.0,Standard,"Volvic Touch of Fruit Low sugar Strawberry Natural Flavoured Water 1.5LVolvic Touch of Fruit Strawberry water is a refreshing blend of Volvic Natural Mineral Water with a touch of natural Strawberry flavour. Each bottle of Volvic flavoured water, refreshes like water & tastes like a touch of fruit.Volvic Touch of Fruit Strawberry, contains only natural flavours and is low in caloriesOur refreshing range of flavoured waters are great for any occasion, whether you need a tasty pick me up, a tasty lunch drink or a low calorie evening meal refreshment. Available in 6 delicious low sugar flavours, try one today.Our 1.5L bottle is the perfect sharing bottle for you and your family. Perfect for mealtimes or when you need a refreshing pick me upOur Volvic Strawberry water is 97.5% water; it refreshes like water, tastes like a Touch of Fruit","['Low sugar', 'Refreshingly fruity volcanic water with a touch of natural strawberry flavour', 'Free from artificial sweeteners']","Volvic Natural Mineral Water (97.5%), Sugar (2.3%), Acid (Citric Acid), Natural Strawberry Flavouring with other Natural Flavourings, Sweetener (Steviol Glycosides from a Natural Source (Stevia Extract))
Preservative (Potassium Benzoate)
Sweetened with an extract from Stevia Leaf","['Free From Artificial Sweeteners', 'Our bottles and caps are 100% recyclable, please recycle', 'Pack Type: Wrap']",Volvic Touch of Fruit Low Sugar Strawberry Natural Flavoured Water,Volvic Touch of Fruit Low Sugar Strawberry Natural Flavoured Water 6 x 1.5L,"{'count': 6, 'size': 1.5, 'unit': 'l', 'format': '6x1.5l'}",True,volvic-touch-of-fruit-low-sugar-strawberry-natural-flavoured-water
826728-1,CocaCola Original Taste 330ml PM 1.09,13.69,Grocery > Soft Drinks > Individual Cans,826728.0,330ml × 24 × 1,https://www.bestwaywholesale.co.uk/img/products/250/2/5000112684322.jpg,https://www.bestwaywholesale.co.uk/product/826728-1,826728,£1.09,Coca-Cola,330ml,826728.0,5000112684322.0,Standard,Coca?Cola Original Taste is the world's favourite soft drink and has been enjoyed since 1886. You can find Coca?Cola Original Taste in a variety of sizes to suit every lifestyle and occasion.,"[""Coca?Cola Original Taste is the world's favourite soft drink and has been enjoyed since 1886"", 'A truly unique & great taste', ""The world's favourite soft drink"", 'Coca-Cola Original Taste, made for sharing', 'Happiness, bottled', 'Carbonated soft drink', 'Carbonated beverage', 'Great taste', 'Delicious and refreshing', 'Added Colours']","Carbonated Water, Sugar, Colour (Caramel E150d), Acid (Phosphoric Acid), Natural Flavourings, Caffeine Flavouring","['Free From Celery', 'Free From Cereals Containing Gluten', 'Free From Crustaceans', 'Free From Eggs', 'Free From Fish', 'Free From Lupin', 'Free From Milk', 'Free From Molluscs', 'Free From Mustard', 'Free From Nuts', 'Free From Peanuts', 'Free From Rye', 'Free From Sulphur Dioxide/Sulphites', 'Free From Wheat', 'Free From Barley', 'Free From Oats', 'Free From Soya', 'Free From Sesame', 'Free From Genetically Modified Ingredients', 'Pack Type: Can']",Cocacola Original Taste,CocaCola Original Taste 330ml PM 1.09,,False,cocacola-original-taste
,,,,,,,https://www.bestwaywholesale.co.ukNone,,,,,,,,,,,,,,,True,
,,,,,,,https://www.bestwaywholesale.co.ukNone,,,,,,,,,,,,,,,True,
821680-1,Nescaf 3 in 1 Original 6 x 16g 96g,8.29,Grocery > Hot Beverages > Coffee and Bev Sachets and Sticks,821680.0,6s × 11 × 1,https://www.bestwaywholesale.co.uk/img/products/250/0/8445291282100.jpg,https://www.bestwaywholesale.co.uk/product/821680-1,Instant coffee beverage,£1.00,Nescafé,6s,821680.0,8445291282094.0,Exempt,Nestlé®Discover the variety of NESCAFÉ In1s,"['Smooth & Rich', '65 Calories Per Mug', 'Low Fat When Prepared', 'No Artificial Flavours', 'Suitable for vegetarians']","Sugar, Glucose Syrup, Instant Coffee (11%), Palm Kernel Oil, Soluble Fibre, SkimmedMilkpowder (0.7%),MilkProteins, Salt, Stabilisers (E331, E452), Lactose (Milk), Acidity Regulator (E340), Emulsifiers (E471, E472e), Natural Flavourings,MilkFat","['Contains Milk', 'Free From Artificial Flavours', 'Recycling Info: Recycle Box', ""Sachet - Recycle at Store - Don't recycle at home"", 'Dispose of Responsibly', 'Find your Nearest Collection Point: WWW.RECYCLENOW.COM', 'Pack Type: Box']",Nescaf 3 in 1 Original,Nescaf 3 in 1 Original 6 x 16g 96g,"{'count': 6, 'size': 16.0, 'unit': 'g', 'format': '6x16g'}",True,nescaf-3-in-1-original
827234-1,Diet Coke 12 x 500ml PM 1.40,7.29,Grocery > Soft Drinks > Small Bottles,827234.0,500ml × 12 × 1,https://www.bestwaywholesale.co.uk/img/products/250/6/5017726449216.jpg,https://www.bestwaywholesale.co.uk/product/827234-1,Sparkling Low Calorie Soft Drink with Plant Extracts with Sweeteners.,£1.40,Diet Coke,500ml,827234.0,5000112684483.0,Standard,"History was made 40 years ago with the creation of Diet Coke. Within two years, Diet Coke was the world's favourite light cola, and it still is! Diet Coke encourages you to love what you love, celebrating that unapologetic attitude that comes with knowing who you are and what you're into, whether it's ‘cool' or not. So add some sparkle to your day - without sugar or calories - with a crisp, refreshing Diet Coke!","['No sugar', 'Love what you love, Diet Coke', 'Coke without sugar', 'Carbonated beverage', 'Great taste', 'Delicious and refreshing', 'GMO Free', 'Added Colours', 'Suitable for Vegans', 'Suitable for Vegetarians']","Carbonated Water, Colour (Caramel E150d), Sweeteners (Aspartame, Acesulfame K), Natural Flavourings, Caffeine Flavouring, Acids (Phosphoric Acid, Citric Acid)","['Free From Celery', 'Free From Cereals Containing Gluten', 'Free From Crustaceans', 'Free From Eggs', 'Free From Fish', 'Free From Lupin', 'Free From Milk', 'Free From Molluscs', 'Free From Mustard', 'Free From Nuts', 'Free From Peanuts', 'Free From Rye', 'Free From Sulphur Dioxide/Sulphites', 'Free From Wheat', 'Free From Barley', 'Free From Oats', 'Free From Soya', 'Free From Sesame', 'Free From Genetically Modified Ingredients', 'Contains Sweeteners', 'Pack Type: Wrap']",Diet Coke,Diet Coke 12 x 500ml PM 1.40,"{'count': 12, 'size': 500.0, 'unit': 'ml', 'format': '12x500ml'}",True,diet-coke
36141-1,Relentless Cherry Energy Drink 500ml PM 1,6.12,Grocery > Soft Drinks > Energy and Health Drinks,36141.0,500ml × 12 × 1,https://www.bestwaywholesale.co.uk/img/products/250/1/5060466510531.jpg,https://www.bestwaywholesale.co.uk/product/36141-1,"Carbonated Cherry Flavour Energy Drink with Taurine, Caffeine and B Vitamins with Sugars and Sweetener",£1.00,Relentless,500ml,36141.0,5000112606027.0,Standard,Where intense fruit flavour refreshment meets the energy needed by those who are driven to pursue their goals with passion and commitment.,[],"Carbonated Water, Sucrose, Glucose, Acid (Citric Acid), Taurine (0.4%), Flavourings, Acidity Regulator (Sodium Citrate), Preservatives (Potassium Sorbate, Sodium Benzoate), Caffeine (0.03%), Sweetener (Sucralose), Vitamins (B3, B5, B6, B12), Colours (E129, E102), Inositol","['Contains Sweeteners', 'Country of Origin United Kingdom', 'Pack Type: Can']",Relentless Cherry Energy Drink,Relentless Cherry Energy Drink 500ml PM 1,,False,relentless-cherry-energy-drink
815759-1,Monster Energy Drink 4 x 500ml PM 5.49,18.49,Grocery > Soft Drinks > Multi Pack Cans,815759.0,500ml × 6 × 1,https://www.bestwaywholesale.co.uk/img/products/250/7/5060947545427.jpg,https://www.bestwaywholesale.co.uk/product/815759-1,"Carbonated Energy Drink with Taurine, Ginseng, L-Carnitine, Caffeine and B Vitamins with Sugars and Sweetener.",£5.49,Monster,500ml,815759.0,5060947545427.0,Standard,Great tasting energy drink with energy blend and 160mg caffeine,"['L-Carnitine + Taurine + Ginseng + B Vitamins', 'This product is GMO free', 'This product is gluten free', 'This product is allergen free']","Carbonated Water, Sucrose, Glucose Syrup, Acid (Citric Acid), Flavourings, Taurine (0.4%), Acidity Regulator (Sodium Citrates), Panax Ginseng Root Extract (0.08%), L-Carnitine L-Tartrate (0.04%), Preservatives (Sorbic Acid, Benzoic Acid), Caffeine (0.03%), Colour (Anthocyanins), Vitamins (B3, B6, B2, B12), Sweetener (Sucralose), Sodium Chloride, D-Glucuronolactone, Guarana Seed Extract (0.002%), Inositol, Maltodextrin","['Free From Celery', 'Free From Cereals Containing Gluten', 'Free From Crustaceans', 'Free From Eggs', 'Free From Fish', 'Free From Lupin', 'Free From Milk', 'Free From Molluscs', 'Free From Mustard', 'Free From Nuts', 'Free From Peanuts', 'Free From Sulphur Dioxide/Sulphites', 'Free From Soya', 'Free From Sesame', 'Free From Genetically Modified Ingredients', 'Contains Sweeteners', 'Recycling Info: Recycle Pack', 'Pack Type: Box']",Monster Energy Drink,Monster Energy Drink 4 x 500ml PM 5.49,"{'count': 4, 'size': 500.0, 'unit': 'ml', 'format': '4x500ml'}",True,monster-energy-drink
819429-1,Lucozade Energy Drink Orange 500ml PMP 1.50 ,18.79,Grocery > Soft Drinks > Energy and Health Drinks,819429.0,500ml × 24 × 1,https://www.bestwaywholesale.co.uk/img/products/250/0/5054267014220.jpg,https://www.bestwaywholesale.co.uk/product/819429-1,Sparkling Orange Glucose Drink with Sugars and Sweeteners,£1.50,Lucozade,500ml,819429.0,5054267014220.0,Standard,"Lucozade is all about unlocking the potential of people's positivity energy! With Vitamin B3 to help reduce tiredness, Lucozade Energy supports your everyday energy to get you through even your busiest days!","['Bursting with orange citrus flavour, Lucozade Orange 500ml is refreshing and zesty! Best enjoyed cold.', '', ""Lucozade is all about unlocking the potential of people's positivity energy! With Vitamin B3 to help reduce tiredness, Lucozade Energy supports your everyday energy to get you through even your busiest days!""]","Carbonated Water, Glucose Syrup (11%), Orange Juice from Concentrate (6%), Acid (Citric Acid), Acidity Regulator (Sodium Gluconate), Flavourings, Preservative (Potassium Sorbate), Sweetener (Sucralose), Sweeteners (Sucralose, Acesulfame K), Stabiliser (Acacia Gum), Caffeine, Antioxidant (Ascorbic Acid), Niacin (Vitamin B3), Colour (Beta Carotene)","['Free From Artificial Colours', 'Contains Sweeteners', 'Recycling Info: Plastic - Widely Recycled Bottle', 'Recycling Info: Plastic - Check Local Recycling Cap', 'Pack Type: Plastic Bottle']",Lucozade Energy Drink Orange,Lucozade Energy Drink Orange 500ml PMP 1.50 ,,False,lucozade-energy-drink-orange
824902-1,Monster Energy Drink Ripper 500ml PMP 1.75,10.69,Grocery > Soft Drinks > Energy and Health Drinks,824902.0,500ml × 12 × 1,https://www.bestwaywholesale.co.uk/img/products/250/3/5056784900123.jpg,https://www.bestwaywholesale.co.uk/product/824902-1,"Carbonated Fruit Energy Drink with 20% Fruit Juice from Fruit Juice Concentrate, Taurine, Ginseng, Caffeine, L-Carnitine and B Vitamins with Sugars and Sweetener.",£1.75,Monster,500ml,824902.0,5056784900123.0,Standard,"The Juice is Loose…The magical smells in the air driving out to surf the North Shore of Oahu was our inspiration for Monster Ripper.We started with a killer combo of tropical juices, added in some famous Monster flavour, then souped it up with a full load of our original Monster Energy blend.Banzai!Monster Ripper…another radical “Juice Monster” hybrid with explosive flavour and the big bad Monster MAGIC you know and love!20% Juice - 100% Monster!","['This product is GMO free', 'This product is allergen free', 'This product is gluten free']","Carbonated Water, Sucrose, Fruit Juice from Concentrate (20%) (Apple, Guava, Passion Fruit, Pineapple, Orange, Lemon), Glucose Syrup, Flavourings, Taurine (0.4%), Acid (Citric Acid), Acidity Regulators (Potassium Citrates, Sodium Citrates), Panax Ginseng Root Extract (0.08%), Preservative (Potassium Sorbate), Caffeine (0.03%), Antioxidant (Ascorbic Acid), Vitamins (B3, B6, B2, B12), Sweetener (Sucralose), L-Carnitine L-Tartrate (0.004%), Sodium Chloride, Colour (E150c), D-Glucuronolactone, Guarana Seed Extract (0.002%), Inositol, Maltodextrin","['Free From Celery', 'Free From Cereals Containing Gluten', 'Free From Crustaceans', 'Free From Eggs', 'Free From Fish', 'Free From Lupin', 'Free From Milk', 'Free From Molluscs', 'Free From Mustard', 'Free From Nuts', 'Free From Peanuts', 'Free From Sulphur Dioxide/Sulphites', 'Free From Soya', 'Free From Sesame', 'Free From Genetically Modified Ingredients', 'Contains Sweeteners', 'Recycling Info: Recycle Pack', 'Pack Type: Can']",Monster Energy Drink Ripper,Monster Energy Drink Ripper 500ml PMP 1.75,,False,monster-energy-drink-ripper
826878-1,Doritos Chilli Heatwave Tortilla Chips Sharing Bag Crisps 70g PMP RRP 1.35,16.49,Grocery > Crisps and Snacks > Snack Single Family,826878.0,70g × 18 × 1,https://www.bestwaywholesale.co.uk/img/products/250/5/5000328036175.jpg,https://www.bestwaywholesale.co.uk/product/826878-1,Chilli Heatwave Flavour Corn Chips,£1.35,Doritos,70g,826878.0,5000328036175.0,Exempt,"- Case of Doritos Chilli Heatwave Tortilla Chips (70g), Price Marked at £1.35- Doritos are VAT free.- To help increase crisps and snacks sales, maximise availability during the afternoon and evenings, by ranging in sharing stands within your beer, wine and spirts aile and within countertop snack units.- Our price marked pack Crisps and Snacks are recommended for stocking in convenience retail outlets- Did you know, our crisp packets can now be recycled? Find out more at walkers.co.uk/recycle Please dispose of your crisp packet responsibly.- Suitable for Vegetarians- No artificial colours or flavours","['Suitable for Vegetarians', 'No Artificial Colours or Flavours']","Corn (Maize), Rapeseed Oil, Chilli Heatwave Flavour [Sugar, Flavourings, Flavour Enhancers (Monosodium Glutamate, Disodium Guanylate), Potassium Chloride, Hydrolysed Vegetable Protein, Salt, Garlic Powder, Paprika Powder, Onion Powder, Acid (Citric Acid), Cayenne Pepper, Colour (Paprika Extract)], Antioxidants (Rosemary Extract, Ascorbic Acid, Tocopherol Rich Extract, Citric Acid).","['May Contain Cereals Containing Gluten', 'May Contain Milk', 'May Contain Wheat', 'May Contain Soya', 'Free From Artificial Colours', 'Free From Artificial Flavours', 'Country of Origin United Kingdom', 'Find out how you can recycle this packet in store at walkers.co.uk/recycle', 'Pack Type: Bag']",Doritos Chilli Heatwave Tortilla Chips Sharing Bag Crisps Pmp,Doritos Chilli Heatwave Tortilla Chips Sharing Bag Crisps 70g PMP RRP 1.35,,False,doritos-chilli-heatwave-tortilla-chips-sharing-bag-crisps-pmp
831145-1,Pepsi Max Cherry No Sugar Bottle PMP 2L,7.69,Grocery > Soft Drinks > 2 and 3 Ltr Bottles,831145.0,2Ltr × 6 × 1,https://www.bestwaywholesale.co.uk/img/products/250/8/4062139024728.jpg,https://www.bestwaywholesale.co.uk/product/831145-1,Carbonated Low Calorie Cherry Cola Flavoured Soft Drink with Sweeteners,£2.19,Pepsi,2Ltr,831145.0,4062139024711.0,Standard,,"['Maximum Taste', 'No Sugar']","Carbonated Water, Colour (E150d), Sweeteners (Aspartame, Acesulfame K), Flavourings (including Caffeine), Acids (Phosphoric Acid, Citric Acid), Preservative (Potassium Sorbate)","['Contains Sweeteners', 'Recycling Info: Recycle Pack', 'Pack Type: Bottle']",Pepsi Max Cherry No Sugar Pmp,Pepsi Max Cherry No Sugar Bottle PMP 2L,,False,pepsi-max-cherry-no-sugar-pmp
812105-1,Barr Cola 2 Litre,3.99,Grocery > Soft Drinks > 2 and 3 Ltr Bottles,812105.0,2Ltr × 6 × 1,https://www.bestwaywholesale.co.uk/img/products/250/8/5000382114888.jpg,https://www.bestwaywholesale.co.uk/product/812105-1,Sparkling Cola Flavour Soft Drink with Sugar and Sweeteners,£1.19,Barr,2Ltr,812105.0,5000382114888.0,Standard,For more information on this product visit www.barrflavours.co.uk,[],"Carbonated Water, Sugar, Colour (Caramel E150d), Flavourings (including Caffeine), Acid (Phosphoric Acid), Sweeteners (Acesulfame K, Sucralose), Preservative (Sodium Benzoate)","['Contains Sweeteners', 'Please recycle', 'Our bottles and caps are 100% recyclable', 'Cap On - Recycle', 'Pack Type: Plastic Bottle']",Barr Cola 2 Litre,Barr Cola 2 Litre,,False,barr-cola-2-litre
826937-1,Walkers Quavers Cheese Snacks Crisps PMP 54g 1.35 RRP,14.15,Grocery > Crisps and Snacks > Single Standard,826937.0,54g × 18 × 1,https://www.bestwaywholesale.co.uk/img/products/250/0/5000328037110.jpg,https://www.bestwaywholesale.co.uk/product/826937-1,Cheese Flavour Potato Snack,£1.35,Walkers,54g,826937.0,5000328037110.0,Standard,"- Case of Walkers Quavers Cheese Snacks (54g), Price Marked at £1.35 RRP- To help increase crisps and snacks sales, maximise availability during the afternoon and evenings, by ranging in sharing stands next to beverages, within your beer, wine and spirts aisle and within counter top snack units- Our price marked pack Crisps and Snacks are recommended for stocking in convenience retail outlets- Contains no artificial colours or preservatives- Suitable for vegetarians","['No Artificial Colours', 'No Artificial Preservaties', 'Suitable For Vegetarians', 'Light & Curly']","Potato Starch, Sunflower Oil, Cheese Flavour [Whey Powder (fromMilk), Flavouring (containsMilk), Flavour Enhancers (Monosodium Glutamate, Disodium 5'Ribonucleotide),MilkPowder, Cheese Powder (fromMilk), Potassium Chloride, Garlic Powder, Acid (Lactic Acid), Colour (Paprika Extract)], Rice Flour,SoyaFlour, Salt, Yeast, Onion Powder (Malt Flour fromBarley), Pepper,Wheatflour (contains Calcium, Iron, Niacin, Thiamin), Colour (Annatto norbixin)","['May Contain Celery', 'Contains Cereals Containing Gluten', 'Contains Milk', 'May Contain Mustard', 'Contains Wheat', 'Contains Barley', 'Contains Soya', 'Free From Artificial Colours', 'Free From Artificial Preservatives', 'Country of Origin United Kingdom', 'Find out how you can recycle this packet in store at walkers.co.uk/recycle', 'Pack Type: Bag']",Walkers Quavers Cheese Snacks Crisps Pmp 1.35 Rrp,Walkers Quavers Cheese Snacks Crisps PMP 54g 1.35 RRP,,False,walkers-quavers-cheese-snacks-crisps-pmp-135-rrp
671307-1,Avant Natural Mineral Water Screwcap,2.95,Grocery > Soft Drinks > Still Water,671307.0,500ml × 24 × 1,https://www.bestwaywholesale.co.uk/img/products/full/upl/671307.jpg,https://www.bestwaywholesale.co.uk/product/671307-1,671307,£0.69,,500ml,671307.0,15060148621125.0,Standard,,[],,[],Avant Natural Mineral Water Screwcap,Avant Natural Mineral Water Screwcap,,False,avant-natural-mineral-water-screwcap
689247-1,Volvic Touch of Fruit Low Sugar Strawberry Natural Flavoured Water 6 x 750ml,4.99,Grocery > Soft Drinks > Flavoured Water,689247.0,75Cl × 6 × 1,https://www.bestwaywholesale.co.uk/img/products/250/3/3057640407093.jpg,https://www.bestwaywholesale.co.uk/product/689247-1,Still natural mineral water flavoured drink with sugar and sweetener.,£1.85,Volvic,75Cl,689247.0,3057640406843.0,Standard,"Volvic Touch of Fruit Low sugar Strawberry Natural Flavoured Water 750mlVolvic Touch of Fruit Strawberry water is a refreshing blend of Volvic Natural Mineral Water with a touch of natural Strawberry flavour. Each bottle of Volvic flavoured water, refreshes like water & tastes like a touch of fruit.Volvic Touch of Fruit Strawberry, contains only natural flavours and is low in caloriesOur refreshing range of flavoured waters are great for any occasion, whether you need a tasty pick me up, a tasty lunch drink or a low calorie evening meal refreshment. Available in 6 delicious low sugar flavours, try one today.Our 750ml sportscap bottle is perfect for on the go, keeping your refreshed throughout the dayOur Volvic Strawberry water is 97.5% water; it refreshes like water, tastes like a Touch of Fruit","['Natural Flavours', 'Low sugar', 'Free from artificial sweeteners']","Volvic Natural Mineral Water (97.5%), Sugar, Acidity Regulator (Citric Acid), Natural Strawberry Flavouring with other Natural Flavourings, Preservative (Potassium Benzoate), Sweetener [Steviol Glycosides from a Natural Source (Stevia Extract)]
Natural Flavourings","['Free From Artificial Sweeteners', ""Our Bottles are 100% Recyclable Please Recycle Don't recycle at home - Recycle with Bags at Large Supermarket"", 'Pack Type: Wrap']",Volvic Touch of Fruit Low Sugar Strawberry Natural Flavoured Water,Volvic Touch of Fruit Low Sugar Strawberry Natural Flavoured Water 6 x 750ml,"{'count': 6, 'size': 750.0, 'unit': 'ml', 'format': '6x750ml'}",True,volvic-touch-of-fruit-low-sugar-strawberry-natural-flavoured-water
