id,name,price,category,sku,multi pack,image,url,product,rsp,brand,size,product_code,Retail Ean,vat_rate,description,description_bullets,ingredients_description,other_info,cleaned_name,original_name,multipack,is_multipack,slug
827210-1,Dr Pepper 12 x 500ml PM 1.40,9.15,Grocery > Soft Drinks > Small Bottles,827210.0,500ml × 12 × 1,https://www.bestwaywholesale.co.uk/img/products/250/1/5017726449551.jpg,https://www.bestwaywholesale.co.uk/product/827210-1,Sparkling Fruit Flavour Soft Drink with Sugar and Sweeteners,£1.40,Dr Pepper,500ml,827210.0,5000112684599.0,Standard,"I don't know what it is, but I like it! For over a century, Dr Pepper's truly unique and wonderfully weird taste has been impossible to describe. A taste so misunderstood, yet confusingly good. A secret blend of 23 flavours creates a deliciously indescribable taste like nothing else out there. The wonderful weirdo sitting in your fridge- refreshing, tasty and surprisingly good, simply served straight over ice. Grab it now, thank us later! So odd, so good, So Misunderstood®","['A combination of 23 unique flavours', 'Sparkling drink', 'Intense Sweetners', 'Added Preservatives', 'Added Colours', 'GMO free, gluten free and allergen free', 'Suitable for vegetarians and vegans']","Carbonated Water, Sugar, Colour (Caramel E150d), Acid (Phosphoric Acid), Sweeteners (Aspartame, Acesulfame K), Preservative (Potassium Sorbate), Flavourings including Caffeine","['Free From Celery', 'Free From Cereals Containing Gluten', 'Free From Crustaceans', 'Free From Eggs', 'Free From Fish', 'Free From Lupin', 'Free From Milk', 'Free From Molluscs', 'Free From Mustard', 'Free From Nuts', 'Free From Peanuts', 'Free From Rye', 'Free From Sulphur Dioxide/Sulphites', 'Free From Wheat', 'Free From Barley', 'Free From Oats', 'Free From Soya', 'Free From Sesame', 'Free From Genetically Modified Ingredients', 'Contains Sweeteners', 'Pack Type: Wrap']",Dr Pepper,Dr Pepper 12 x 500ml PM 1.40,"{'count': 12, 'size': 500.0, 'unit': 'ml', 'format': '12x500ml'}",True,dr-pepper
,,,,,,,https://www.bestwaywholesale.co.ukNone,,,,,,,,,,,,,,,True,
,,,,,,,https://www.bestwaywholesale.co.ukNone,,,,,,,,,,,,,,,True,
671407-1,Avant Natural Mineral Water,2.39,Grocery > Soft Drinks > Still Water,671407.0,1.5Ltr × 6 × 1,https://www.bestwaywholesale.co.uk/img/products/full/upl/671407.jpg,https://www.bestwaywholesale.co.uk/product/671407-1,671407,£0.99,,1.5Ltr,671407.0,15060148321142.0,Standard,,[],,[],Avant Natural Mineral Water,Avant Natural Mineral Water,,False,avant-natural-mineral-water
830044-1,CocaCola Original Taste 8 x 330ml PM 5.99,11.49,Grocery > Soft Drinks > Multi Pack Cans,830044.0,330ml × 3 × 1,https://www.bestwaywholesale.co.uk/img/products/250/7/5000112688337.jpg,https://www.bestwaywholesale.co.uk/product/830044-1,Sparkling Soft Drink with Plant Extracts,£5.99,Coca-Cola,330ml,830044.0,5000112688337.0,Standard,Coca?Cola Original Taste is the world's favourite soft drink and has been enjoyed since 1886. You can find Coca?Cola Original Taste in a variety of sizes to suit every lifestyle and occasion.,"['A truly unique & great taste', ""The world's favourite soft drink"", 'Coca-Cola Original Taste, made for sharing', 'Sparkling soft drink', 'Happiness, bottled', 'Carbonated soft drink', 'Flavoured drink', 'Carbonated beverage', 'Delicious and refreshing', 'GMO Free?', 'No Added Preservatives', 'No Intense Sweetners', 'Suitable for Vegetarians', 'Suitable for Vegans']","Carbonated Water, Sugar, Colour (E 150d), Acid (Phosphoric Acid), Natural Flavourings, Caffeine Flavouring","['Free From Celery', 'Free From Cereals Containing Gluten', 'Free From Crustaceans', 'Free From Eggs', 'Free From Fish', 'Free From Lupin', 'Free From Milk', 'Free From Molluscs', 'Free From Mustard', 'Free From Peanuts', 'Free From Rye', 'Free From Sulphur Dioxide/Sulphites', 'Free From Wheat', 'Free From Barley', 'Free From Oats', 'Free From Soya', 'Free From Sesame', 'Free From Genetically Modified Ingredients', 'Contains Sweeteners', 'Pack Type: Can']",Cocacola Original Taste,CocaCola Original Taste 8 x 330ml PM 5.99,"{'count': 8, 'size': 330.0, 'unit': 'ml', 'format': '8x330ml'}",True,cocacola-original-taste
826474-1,Red Bull Energy Drink Peach Edition White Peach 12 x 250ml PM 1.65,9.89,Grocery > Soft Drinks > Energy and Health Drinks,826474.0,250ml × 12 × 1,https://www.bestwaywholesale.co.uk/img/products/250/6/9002490281236.jpg,https://www.bestwaywholesale.co.uk/product/826474-1,Energy Drink with the taste of White Peach,£1.65,Red Bull,250ml,826474.0,9002490281236.0,Standard,Niacin and vitamin B6 contribute to the reduction of tiredness and fatigue as well as to normal energy-yielding metabolism.,"['Vitalizes body and mind®', 'Pasteurised']","Water, Sucrose, Glucose, Acid (Citric Acid), Carbon Dioxide, Taurine (0.4%), Acidity Regulator (Sodium Citrates), Caffeine (0.03%), Vitamins (Niacin, Pantothenic Acid, B6, B12), Flavourings",['Pack Type: Can'],Red Bull Energy Drink Peach Edition White Peach,Red Bull Energy Drink Peach Edition White Peach 12 x 250ml PM 1.65,"{'count': 12, 'size': 250.0, 'unit': 'ml', 'format': '12x250ml'}",True,red-bull-energy-drink-peach-edition-white-peach
808867-1,Avant Mineral Water,2.79,Grocery > Soft Drinks > Still Water,808867.0,5Ltr × 3 × 1,https://www.bestwaywholesale.co.uk/img/products/full/upl/808867.jpg,https://www.bestwaywholesale.co.uk/product/808867-1,808867,£1.99,,5Ltr,808867.0,25060148621153.0,Standard,,[],,[],Avant Mineral Water,Avant Mineral Water,,False,avant-mineral-water
824423-1,Monster Energy Drink Pacific Punch 500ml PM 1.75,10.69,Grocery > Soft Drinks > Energy and Health Drinks,824423.0,500ml × 12 × 1,https://www.bestwaywholesale.co.uk/img/products/250/2/5056784900062.jpg,https://www.bestwaywholesale.co.uk/product/824423-1,"Carbonated Energy Drink with 6% Fruit Juice from Fruit Juice Concentrate, containing Taurine, Caffeine, L-Carnitine and B Vitamins with Sugars and Sweetener",£1.75,Monster,500ml,824423.0,5056784900062.0,Standard,"Typical punch it's Not! Lighter, less sweet and more complex. A flavour as deep and wide as its name sake the great Pacific.Naturally we added our Monster Energy Blend to help put wind in your sails and keep you steady and on course no matter how rough the seas.Pacific Punch your adventure awaits arrgh…Unleash the Salty Beast! ®","['L-Carnitine + Taurine + B Vitamins', 'This product is allergen free', 'This product is GMO free', 'This product is gluten free']","Carbonated Water, Sucrose, Fruit Juices from Concentrate (6%) (Orange, Apple, Raspberry, Cherry, Guava, Pineapple, Passion Fruit), Glucose Syrup, Taurine (0.4%), Acid (Citric Acid), Maltodextrin, Flavourings, Acidity Regulator (Sodium Citrates), Preservatives (Potassium Sorbate, Sodium Benzoate), Caffeine (0.03%), Stabilisers (Acacia Gum, Glycerol Esters of Wood Rosins), Sweetener (Sucralose), Vitamins (B3, B6, B2, B12), L-Carnitine L-Tartrate (0.004%), Sodium Chloride, Inositol, Colours (E129, E133)","['Free From Celery', 'Free From Cereals Containing Gluten', 'Free From Crustaceans', 'Free From Eggs', 'Free From Fish', 'Free From Lupin', 'Free From Milk', 'Free From Molluscs', 'Free From Mustard', 'Free From Nuts', 'Free From Peanuts', 'Free From Sulphur Dioxide/Sulphites', 'Free From Soya', 'Free From Sesame', 'Free From Genetically Modified Ingredients', 'Contains Sweeteners', 'Recycling Info: Recycle Pack', 'Pack Type: Can']",Monster Energy Drink Pacific Punch,Monster Energy Drink Pacific Punch 500ml PM 1.75,,False,monster-energy-drink-pacific-punch
824419-1,Monster Energy Drink Mixed Punch 500ml PM 1.75,10.69,Grocery > Soft Drinks > Energy and Health Drinks,824419.0,500ml × 12 × 1,https://www.bestwaywholesale.co.uk/img/products/250/2/5061013949972.jpg,https://www.bestwaywholesale.co.uk/product/824419-1,"Carbonated Energy Drink with 5.3% Fruit Juice from Juice Concentrate, Taurine, Caffeine, L-Carnitine and B Vitamins with Sugars and Sweetener.",£1.75,Monster,500ml,824419.0,5061013949972.0,Standard,"There's always someone who likes to mix things up the party. The DJ mixing the music or someone mixing the punch bowl to get the party rolling!At Monster we like to stir things up a bit too and inevitably our next great concoction comes to life.Monster Mixed, a tropical punch sensation packed with a full load of our Monster Energy blend. It's sure to get the party started, day or night!","['This product is GMO free', 'This product is gluten free', 'L-Carnitine + Taurine + B-Vitamins']","Carbonated Water, Sucrose, Fruit Juices from Concentrate (5.3%) (Apple, Cherry, Mango, Cranberry, Banana), Glucose Syrup, Taurine (0.4%), Acid (Citric Acid), Acidity Regulator (Sodium Citrates), Flavourings, Thickener (Pectins), Preservatives (Potassium Sorbate, Sodium Benzoate), Caffeine (0.03%), Sweetener (Sucralose), Vitamins (B3, B6, B2, B12), Colours (E120, E163), L-Carnitine L-Tartrate (0.004%), Stabilisers (Acacia Gum, Glycerol Esters of Wood Rosins), Sodium Chloride, Inositol, Maltodextrin","['Free From Celery', 'Free From Cereals Containing Gluten', 'Free From Crustaceans', 'Free From Eggs', 'Free From Fish', 'Free From Lupin', 'Free From Milk', 'Free From Molluscs', 'Free From Mustard', 'Free From Nuts', 'Free From Peanuts', 'Free From Sulphur Dioxide/Sulphites', 'Free From Soya', 'Free From Sesame', 'Free From Genetically Modified Ingredients', 'Contains Sweeteners', 'Recycling Info: Recycle Pack', 'Pack Type: Can']",Monster Energy Drink Mixed Punch,Monster Energy Drink Mixed Punch 500ml PM 1.75,,False,monster-energy-drink-mixed-punch
827211-1,Dr Pepper 6 x 2L PM 2.15,7.29,Grocery > Soft Drinks > 2 and 3 Ltr Bottles,827211.0,2Ltr × 6 × 1,https://www.bestwaywholesale.co.uk/img/products/250/7/5017726449537.jpg,https://www.bestwaywholesale.co.uk/product/827211-1,Sparkling Fruit Flavour Soft Drink with Sugar and Sweeteners,£2.15,Dr Pepper,2Ltr,827211.0,5000112684612.0,Standard,"I don't know what it is, but I like it! For over a century, Dr Pepper's truly unique and wonderfully weird taste has been impossible to describe. A taste so misunderstood, yet confusingly good. A secret blend of 23 flavours creates a deliciously indescribable taste like nothing else out there. The wonderful weirdo sitting in your fridge- refreshing, tasty and surprisingly good, simply served straight over ice. Grab it now, thank us later! So odd, so good, So Misunderstood®","['GMO free, gluten free and allergen free', 'Added Preservatives', 'Added Colours', 'Intense Sweetners', 'Suitable for Vegans', 'Suitable for Vegetarians']","Carbonated Water, Sugar, Colour (Caramel E150d), Acid (Phosphoric Acid), Sweeteners (Aspartame, Acesulfame K), Preservative (Potassium Sorbate), Flavourings including Caffeine","['Free From Celery', 'Free From Cereals Containing Gluten', 'Free From Crustaceans', 'Free From Eggs', 'Free From Fish', 'Free From Lupin', 'Free From Milk', 'Free From Molluscs', 'Free From Mustard', 'Free From Nuts', 'Free From Peanuts', 'Free From Rye', 'Free From Sulphur Dioxide/Sulphites', 'Free From Wheat', 'Free From Barley', 'Free From Oats', 'Free From Soya', 'Free From Sesame', 'Free From Genetically Modified Ingredients', 'Contains Sweeteners', 'Pack Type: Wrap']",Dr Pepper,Dr Pepper 6 x 2L PM 2.15,"{'count': 6, 'size': 2.0, 'unit': 'l', 'format': '6x2l'}",True,dr-pepper
820301-1,Diet Coke 2L PM 2.29,7.27,Grocery > Soft Drinks > 2 and 3 Ltr Bottles,820301.0,2Ltr × 6 × 1,https://www.bestwaywholesale.co.uk/img/products/250/8/5000112669688.jpg,https://www.bestwaywholesale.co.uk/product/820301-1,Sparkling Low Calorie Soft Drink with Plant Extracts with Sweeteners,£2.29,Diet Coke,2Ltr,820301.0,5000112669688.0,Standard,"Celebrating that unapologetic attitude that comes with knowing who you are and what you're into. Love what you love, Diet Coke.Add some sparkle to your day without the sugar or calories, with a crisp, refreshing Diet Coke!","['Crisp and refreshing with no sugar and no calories', 'Suitable for Vegans', 'Suitable for Vegetarians']","Carbonated Water, Colour (Caramel E150d), Sweeteners (Aspartame, Acesulfame K), Natural Flavourings, Caffeine Flavouring, Acids (Phosphoric Acid, Citric Acid)","['Free From Celery', 'Free From Cereals Containing Gluten', 'Free From Crustaceans', 'Free From Eggs', 'Free From Fish', 'Free From Lupin', 'Free From Milk', 'Free From Molluscs', 'Free From Mustard', 'Free From Nuts', 'Free From Peanuts', 'Free From Rye', 'Free From Sulphur Dioxide/Sulphites', 'Free From Wheat', 'Free From Barley', 'Free From Oats', 'Free From Soya', 'Free From Sesame', 'Contains Sweeteners', 'Pack Type: Plastic Bottle']",Diet Coke,Diet Coke 2L PM 2.29,,False,diet-coke
828741-1,Oasis Summer Fruits 12 x 500ml PM 1.40,9.49,Grocery > Soft Drinks > Small Bottles,828741.0,500ml × 12 × 1,https://www.bestwaywholesale.co.uk/img/products/250/0/5017726450090.jpg,https://www.bestwaywholesale.co.uk/product/828741-1,Still Summer Fruits Juice Drink with Sugar and Sweeteners,£1.40,Oasis,500ml,828741.0,5000112684810.0,Standard,"Oasis Summer Fruits is a great tasting refreshing still juice drink full of zing. A perfectly balanced combination of cheeky and colourful flavours with a tasty blend of your favourite sweet apple, ripe strawberry, sweet-tart red currant & juicy cherry flavours. At home and on the go, you'll experience great taste and indulge your senses. Oasis Summer Fruits contains natural flavours to brighten up your day. No GMO, no allergen & gluten free.","['Refreshing still drink with natural fruity flavour', 'Made with a unique blend of 100% natural flavours and real fruit', 'Low in calories', 'GMO free', 'Suitable for Vegans', 'Suitable for Vegetarians']","Water, Fruit Juices from Concentrate 5% (Apple 1.7%, Strawberry 1.5%, Redcurrant 1.2%, Cherry 0.6%), Sugar, Acid (Citric Acid), Fruit And Vegetable Concentrates (Carrot, Apple, Blackcurrant, Blueberry, Hibiscus), Natural Berry Flavouring with Other Natural Flavourings, Stabiliser (Polyphosphates), Acidity Regulator (Sodium Citrates), Preservatives (Potassium Sorbate, Sodium Benzoate), Sweeteners (Aspartame, Acesulfame K)","['Free From Celery', 'Free From Cereals Containing Gluten', 'Free From Crustaceans', 'Free From Eggs', 'Free From Fish', 'Free From Lupin', 'Free From Milk', 'Free From Mustard', 'Free From Nuts', 'Free From Peanuts', 'Free From Rye', 'Free From Sulphur Dioxide/Sulphites', 'Free From Wheat', 'Free From Barley', 'Free From Soya', 'Free From Sesame', 'Free From Genetically Modified Ingredients', 'Contains Sweeteners', 'Pack Type: Wrap']",Oasis Summer Fruits,Oasis Summer Fruits 12 x 500ml PM 1.40,"{'count': 12, 'size': 500.0, 'unit': 'ml', 'format': '12x500ml'}",True,oasis-summer-fruits
824086-1,Nestle Pure Life Still Spring Water 6x1.5L,1.99,Grocery > Soft Drinks > Still Water,824086.0,1.5Ltr × 6 × 1,https://www.bestwaywholesale.co.uk/img/products/250/2/8445291373082.jpg,https://www.bestwaywholesale.co.uk/product/824086-1,824086,£0.69,Nestle Pure Life,1.5Ltr,824086.0,7613035281783.0,Standard,"Choose Nestlé Pure Life for your family, enjoy during mealtimes!","['Still Spring Water bottled at the source in the UK', '100% recyclable packaging, please recycle to give the bottles a new life', 'Championing to build healthy habits for a healthy future', 'Optimal balance of minerals and a light pure taste', ""Purity and safety guaranteed by Nestlé's expertise""]",,"[""Recycling Info: Recycle with bags at large supermarket - Don't recycle at home Film"", 'Recycling Info: Recycle Bottle', '100% Recyclable & Made With 30% Recycled Plastic Excl', 'Cap & Label', 'Pack Type: Wrap']",Nestle Pure Life Still Spring Water,Nestle Pure Life Still Spring Water 6x1.5L,"{'count': 6, 'size': 1.5, 'unit': 'l', 'format': '6x1.5l'}",True,nestle-pure-life-still-spring-water
827205-1,CocaCola Zero Sugar 6 x 2L PM 2.29,7.27,Grocery > Soft Drinks > 2 and 3 Ltr Bottles,827205.0,2Ltr × 6 × 1,https://www.bestwaywholesale.co.uk/img/products/250/4/5017726449384.jpg,https://www.bestwaywholesale.co.uk/product/827205-1,Sparkling Low Calorie Soft Drink with Plant Extracts with Sweeteners.,£2.29,Coca-Cola,2Ltr,827205.0,5000112684933.0,Standard,"Coca-Cola Zero Sugar is the legendary flavoured sparkling soft drink, without sugar. Everything about Coca-Cola Zero Sugar is unique; from its iconic flavour to the famous bottle. This all-time classic is designed with a crisp and unique flavour. But it's not only about the great taste. Coca-Cola Zero Sugar is so much more.","['Great Coca-Cola taste with zero sugar & zero calories', 'Coca-Cola Zero Sugar, bringing happiness to fans', 'Sparkling soft drink', 'Happiness, bottled', 'Coke without sugar', 'Carbonated beverage', 'Great taste', 'Delicious and refreshing', 'GMO Free', 'Added Colours', 'Intense Sweetners', 'Suitable for Vegans', 'Suitable for Vegetarians']","Carbonated Water, Colour (E 150d), Acid (Phosphoric Acid), Sweeteners (Aspartame, Acesulfame-K, Enzymatically produced Steviol Glycosides), Natural Flavourings, Caffeine Flavouring, Acidity Regulator (Sodium Citrates)","['Free From Celery', 'Free From Cereals Containing Gluten', 'Free From Crustaceans', 'Free From Eggs', 'Free From Fish', 'Free From Lupin', 'Free From Milk', 'Free From Molluscs', 'Free From Mustard', 'Free From Nuts', 'Free From Peanuts', 'Free From Rye', 'Free From Sulphur Dioxide/Sulphites', 'Free From Wheat', 'Free From Barley', 'Free From Oats', 'Free From Soya', 'Free From Sesame', 'Free From Genetically Modified Ingredients', 'Contains Sweeteners', 'Pack Type: Wrap']",Cocacola Zero Sugar,CocaCola Zero Sugar 6 x 2L PM 2.29,"{'count': 6, 'size': 2.0, 'unit': 'l', 'format': '6x2l'}",True,cocacola-zero-sugar
815760-1,Monster Energy Drink Ultra Zero Sugar 4 x 500ml PM 4.99,15.79,Grocery > Soft Drinks > Multi Pack Cans,815760.0,500ml × 6 × 1,https://www.bestwaywholesale.co.uk/img/products/250/9/5060947545519.jpg,https://www.bestwaywholesale.co.uk/product/815760-1,"Carbonated Energy Drink with Taurine, Ginseng, Caffeine, L-Carnitine and B Vitamins with Sweeteners.",£4.99,Monster Energy,500ml,815760.0,5060947545519.0,Standard,"Some people are impossible to please. As soon as they get what they thought they wanted they always want more. Our team riders and Monster Girls are no different….. they've been dropping some hints lately.They've been asking us for a new Monster drink. A little less sweet, lighter-tasting and zero calories, but with a full load of our Monster energy blend.Sure, white is the new black. We went all out: Monster Energy Ultra.Unleash the Ultra Beast!","['Taurine + Zero Sugar + L-Carnitine', 'This product is GMO free', 'This product is gluten free', 'This product is allergen free', 'This product is suitable for vegetarians/vegans']","Carbonated Water, Acid (Citric Acid), Taurine (0.4%), Acidity Regulator (Sodium Citrates), Flavourings, Panax Ginseng Root Extract (0.08%), Sweeteners (Sucralose, Acesulfame K), Preservatives (Sorbic Acid, Benzoic Acid), Caffeine (0.03%), L-Carnitine L-Tartrate (0.015%), Vitamins (B3, B5, B6, B12), Sodium Chloride, D-Glucuronolactone, Guarana Seed Extract (0.002%), Inositol","['Free From Celery', 'Free From Cereals Containing Gluten', 'Free From Crustaceans', 'Free From Eggs', 'Free From Fish', 'Free From Lupin', 'Free From Milk', 'Free From Molluscs', 'Free From Mustard', 'Free From Nuts', 'Free From Peanuts', 'Free From Sulphur Dioxide/Sulphites', 'Free From Soya', 'Free From Sesame', 'Free From Genetically Modified Ingredients', 'Contains Sweeteners', 'Recycling Info: Recycle Pack', 'Pack Type: Can']",Monster Energy Drink Ultra Zero Sugar,Monster Energy Drink Ultra Zero Sugar 4 x 500ml PM 4.99,"{'count': 4, 'size': 500.0, 'unit': 'ml', 'format': '4x500ml'}",True,monster-energy-drink-ultra-zero-sugar
826721-1,CocaCola Cherry 1.75L PM 2.79,8.99,Grocery > Soft Drinks > 1 and 1.5 Ltr Bottles,826721.0,1.75Ltr × 6 × 1,https://www.bestwaywholesale.co.uk/img/products/250/6/5000112684346.jpg,https://www.bestwaywholesale.co.uk/product/826721-1,Sparkling Cherry Flavour Soft Drink with Plant Extracts.,£2.79,Coca-Cola,1.75Ltr,826721.0,5000112684346.0,Standard,"Coca-Cola Cherry, a refreshingly smooth combination of the legendary Coca-Cola sparkling soft drink, first created in 1886 and a sweet cherry flavour. This all-time classic carbonated drink with a crisp and sweet flavour. Always ready & by your side, made for sharing. Simply lean back and relax. Take a sip and free the bubbles inside.","['Coca-cola with smooth cherry flavour delicious and refreshing sparkling soft drink', 'Refreshing Coca-Cola cherry with a delicious flavour', 'Incredible taste with a twist of smooth cherry flavour', 'Carbonated drink with a twist of smooth cherry', 'Sparkling soft drink', 'Flavoured drink', 'Great taste', 'Suitable for Vegans', 'Suitable for Vegetarians']","Carbonated Water, Sugar, Colour (E 150d), Acid (Phosphoric Acid), Natural Flavourings, Caffeine Flavouring","['Free From Celery', 'Free From Cereals Containing Gluten', 'Free From Crustaceans', 'Free From Eggs', 'Free From Fish', 'Free From Lupin', 'Free From Milk', 'Free From Molluscs', 'Free From Mustard', 'Free From Nuts', 'Free From Peanuts', 'Free From Rye', 'Free From Sulphur Dioxide/Sulphites', 'Free From Wheat', 'Free From Barley', 'Free From Oats', 'Free From Soya', 'Free From Sesame', 'Free From Genetically Modified Ingredients', 'Pack Type: Bottle']",Cocacola Cherry,CocaCola Cherry 1.75L PM 2.79,,False,cocacola-cherry
827219-1,Fanta Orange 6 x 2L PM 2.15 Bottle,7.27,Grocery > Soft Drinks > 2 and 3 Ltr Bottles,827219.0,2Ltr × 6 × 1,https://www.bestwaywholesale.co.uk/img/products/250/5/5017726449605.jpg,https://www.bestwaywholesale.co.uk/product/827219-1,Sparkling Orange Fruit Drink with Sugar and Sweeteners.,£2.15,Fanta,2Ltr,827219.0,5000112684544.0,Standard,Fanta Orange is a tongue-tingling & delicious sparkling flavoured drink that surprises with its intense and refreshing taste. Add to your shopping list and enjoy the bubbles inside,"['Sparkling orange flavoured soft drink', 'Great and refreshing taste', 'Vibrant and refreshing', 'Made with fruit juice & flavours', 'Natural flavours', 'Flavoured drink', 'Suitable for vegetarians and vegans']","Carbonated Water, Sugar, Orange Juice from Concentrate (2.3%), Lemon Juice from Concentrate (1%), Citrus Fruit from Concentrate (0.6%), Acids (Malic Acid, Citric Acid), Sweeteners (Cyclamates, Acesulfame K, Saccharins), Acidity Regulators (Calcium Lactate, Calcium Gluconate), Stabilisers (Acacia Gum, Guar Gum), Preservative (Potassium Sorbate), Natural Orange Flavouring with other Natural Flavourings, Antioxidant (Ascorbic Acid), Colour (Carotenes)","['Free From Celery', 'Free From Cereals Containing Gluten', 'Free From Crustaceans', 'Free From Eggs', 'Free From Fish', 'Free From Lupin', 'Free From Milk', 'Free From Molluscs', 'Free From Mustard', 'Free From Nuts', 'Free From Peanuts', 'Free From Rye', 'Free From Sulphur Dioxide/Sulphites', 'Free From Wheat', 'Free From Barley', 'Free From Oats', 'Free From Soya', 'Free From Sesame', 'Free From Genetically Modified Ingredients', 'Contains Sweeteners', 'Pack Type: Bottle']",Fanta Orange,Fanta Orange 6 x 2L PM 2.15 Bottle,"{'count': 6, 'size': 2.0, 'unit': 'l', 'format': '6x2l'}",True,fanta-orange
831144-1,Pepsi Max Cola Bottle PMP 500ml ,9.29,Grocery > Soft Drinks > Small Bottles,831144.0,500ml × 12 × 1,https://www.bestwaywholesale.co.uk/img/products/250/6/4062139024216.jpg,https://www.bestwaywholesale.co.uk/product/831144-1,Carbonated Low Calorie Cola Flavoured Soft Drink with Sweeteners,£1.39,Pepsi,500ml,831144.0,4062139024209.0,Standard,"Product composition varies in the EU, visit www.info.pepsico.eu for details.","['Maximum Taste', 'No Sugar']","Carbonated Water, Colour (E150d), Sweeteners (Aspartame, Acesulfame K), Acids (Phosphoric Acid, Citric Acid), Flavourings (including Caffeine), Preservative (Potassium Sorbate)","['Contains Sweeteners', 'Recycling Info: Recycle Pack', 'Pack Type: Bottle']",Pepsi Max Cola Pmp,Pepsi Max Cola Bottle PMP 500ml ,,False,pepsi-max-cola-pmp
