id,name,price,category,sku,multi pack,image,url,product,rsp,brand,size,product_code,Retail Ean,vat_rate,description,description_bullets,ingredients_description,other_info,cleaned_name,original_name,multipack,is_multipack,slug
812101-1,Barr Lemonade 2l Bottle,4.15,Grocery > Soft Drinks > 2 and 3 Ltr Bottles,812101.0,2Ltr × 6 × 1,https://www.bestwaywholesale.co.uk/img/products/250/5/5000382114765.jpg,https://www.bestwaywholesale.co.uk/product/812101-1,Sparkling Lemon Flavour Soft Drink with Sugar and Sweeteners,£1.19,Barr,2Ltr,812101.0,5000382114765.0,Standard,For more information on this product visit www.barrflavours.co.uk,[],"Carbonated Water, Sugar, Acid (Citric Acid), Flavourings, Acidity Regulator (Trisodium Citrate), Sweeteners (Aspartame, Acesulfame K), Preservative (Potassium Sorbate)","['Contains Sweeteners', 'Please recycle', 'Our bottles and caps are 100% recyclable', 'Cap On - Recycle', 'Pack Type: Plastic Bottle']",Barr Lemonade,Barr Lemonade 2l Bottle,,False,barr-lemonade
812170-1,Lucozade Energy Drink Original 900ml PMP 2,13.79,Grocery > Soft Drinks > Energy and Health Drinks,812170.0,900ml × 12 × 1,https://www.bestwaywholesale.co.uk/img/products/250/3/5054267013063.jpg,https://www.bestwaywholesale.co.uk/product/812170-1,Sparkling Glucose Drink with sugars and sweeteners,£2.00,Lucozade,900ml,812170.0,5054267013063.0,Standard,"Made with glucoseWhatever you do, do it with energyEnjoy as part of a varied and balanced diet and healthy llifestyle","['Lucozade Energy Original 900ml. Lucozade Energy contains Glucose, and has the original taste so many know and love! Best enjoyed cold.']","Carbonated Water, Glucose Syrup (13%), Acids (Citric Acid, Lactic Acid), Acidity Regulator (Sodium Citrate), Flavourings, Preservative (Potassium Sorbate), Caffeine, Sweeteners (Sucralose, Acesulfame K), Antioxidant (Ascorbic Acid), Colours (Sunset Yellow, Ponceau 4R), Niacin (Vitamin B3)","['Contains Sweeteners', 'Recycling Info: Plastic - Widely Recycled Bottle', 'Pack Type: Plastic Bottle']",Lucozade Energy Drink Original,Lucozade Energy Drink Original 900ml PMP 2,,False,lucozade-energy-drink-original
831167-1,Pepsi Cola PMP Bottle 2L ,8.69,Grocery > Soft Drinks > 2 and 3 Ltr Bottles,831167.0,2Ltr × 6 × 1,https://www.bestwaywholesale.co.uk/img/products/250/2/4062139024872.jpg,https://www.bestwaywholesale.co.uk/product/831167-1,Carbonated Cola Flavoured Soft Drink with Sugar and Sweeteners,£2.49,Pepsi,2Ltr,831167.0,4062139024865.0,Standard,"Product composition varies in the EU, visit www.info.pepsico.eu for details.",[],"Carbonated Water, Sugar, Colour (E150d), Flavourings (including Caffeine), Acid (Phosphoric Acid), Sweeteners (Acesulfame K, Sucralose)","['Contains Sweeteners', 'Recycling Info: Recycle Pack', 'Pack Type: Bottle']",Pepsi Cola Pmp,Pepsi Cola PMP Bottle 2L ,,False,pepsi-cola-pmp
827212-1,Dr Pepper 24 x 330ml PM 85p,10.45,Grocery > Soft Drinks > Individual Cans,827212.0,330ml × 24 × 1,https://www.bestwaywholesale.co.uk/img/products/250/4/5017726449544.jpg,https://www.bestwaywholesale.co.uk/product/827212-1,Sparkling Fruit Flavour Soft Drink with Sugar and Sweeteners,£0.85,Dr Pepper,330ml,827212.0,5000112684605.0,Standard,"I don't know what it is, but I like it! For over a century, Dr Pepper's truly unique and wonderfully weird taste has been impossible to describe. A taste so misunderstood, yet confusingly good. A secret blend of 23 flavours creates a deliciously indescribable taste like nothing else out there. The wonderful weirdo sitting in your fridge- refreshing, tasty and surprisingly good, simply served straight over ice. Grab it now, thank us later! So odd, so good, So Misunderstood®","['A combination of 23 unique flavours', 'Sparkling drink', 'GMO free, gluten free and allergen free', 'Added Preservatives', 'Added Colours', 'Intense Sweetners', 'Suitable for vegetarians and vegans']","Carbonated Water, Sugar, Colour (Caramel E150d), Acid (Phosphoric Acid), Sweeteners (Aspartame, Acesulfame K), Preservative (Potassium Sorbate), Flavourings including Caffeine","['Free From Celery', 'Free From Cereals Containing Gluten', 'Free From Crustaceans', 'Free From Eggs', 'Free From Fish', 'Free From Lupin', 'Free From Milk', 'Free From Molluscs', 'Free From Mustard', 'Free From Nuts', 'Free From Peanuts', 'Free From Rye', 'Free From Sulphur Dioxide/Sulphites', 'Free From Wheat', 'Free From Barley', 'Free From Oats', 'Free From Hazelnuts', 'Free From Soya', 'Free From Sesame', 'Free From Genetically Modified Ingredients', 'Contains Sweeteners', 'Pack Type: Wrap']",Dr Pepper,Dr Pepper 24 x 330ml PM 85p,"{'count': 24, 'size': 330.0, 'unit': 'ml', 'format': '24x330ml'}",True,dr-pepper
824539-1,Monster Energy Drink Ultra Rosa Zero Sugar 500ml PM 1.65,9.89,Grocery > Soft Drinks > Energy and Health Drinks,824539.0,500ml × 12 × 1,https://www.bestwaywholesale.co.uk/img/products/250/0/5061013949910.jpg,https://www.bestwaywholesale.co.uk/product/824539-1,"Carbonated Energy Drink with Taurine, Ginseng, Caffeine, L-Carnitine and B Vitamins with Sweeteners",£1.65,Monster,500ml,824539.0,5061013949910.0,Standard,"Roses are red, grapefruit is pink, Ultra Rosá is not what you think. Forget about pink lemonade, blush wine, guavas and strawberries. Ultra Rosá is a whole new experience. Crafted with a light and easy drinking flavour that's also crisp and complex with a floral finish. There's no better way to describe the taste than - it tastes like Ultra Rosá! Zero sugar with a full load of our Monster Energy blend.","['Taurine + Zero Sugar + L-Carnitine', 'This product is GMO free', 'This product is gluten free', 'This product is allergen free']","Carbonated Water, Acid (Citric Acid), Flavour Enhancer (Erythritol), Taurine (0.4%), Acidity Regulator (Sodium Citrates), Flavourings, Panax Ginseng Root Extract (0.08%), Preservatives (Sorbic Acid, Benzoic Acid), Sweeteners (Sucralose, Acesulfame K), Caffeine (0.03%), L-Carnitine L-Tartrate (0.015%), Vitamins (B3, B5, B6, B12), Purple Sweet Potato Concentrate, Inositol","['Free From Celery', 'Free From Cereals Containing Gluten', 'Free From Crustaceans', 'Free From Eggs', 'Free From Fish', 'Free From Lupin', 'Free From Milk', 'Free From Molluscs', 'Free From Mustard', 'Free From Nuts', 'Free From Peanuts', 'Free From Sulphur Dioxide/Sulphites', 'Free From Soya', 'Free From Sesame', 'Free From Genetically Modified Ingredients', 'Contains Sweeteners', 'Recycling Info: Recycle Pack', 'Pack Type: Can']",Monster Energy Drink Ultra Rosa Zero Sugar,Monster Energy Drink Ultra Rosa Zero Sugar 500ml PM 1.65,,False,monster-energy-drink-ultra-rosa-zero-sugar
824416-1,Monster Energy Drink Khaotic 500ml PM 1.75,10.69,Grocery > Soft Drinks > Energy and Health Drinks,824416.0,500ml × 12 × 1,https://www.bestwaywholesale.co.uk/img/products/250/4/5056784900154.jpg,https://www.bestwaywholesale.co.uk/product/824416-1,"Carbonated Energy Drink with 10% Fruit Juice from Fruit Juice Concentrate, Taurine, Ginseng, Caffeine, L-Carnitine and B Vitamins with Sugars and Sweeteners.",£1.75,Monster,500ml,824416.0,5056784900154.0,Standard,Back in “05” the original Monster with juice shook-up the game by combining great tasting juice with energy drink functionality and attitude. Now over a decade later we decided it was time for a little makeover of the classic. We lightened-up the flavour and adjusted the blend to create a taste that is better experienced than described. Of course our Monster Energy DNA remains unchanged. For our new paint job we called on longtime friend and legendary street artist Risk. His iconic west coast style and vibrant presentation perfectly captures the spirit of our original Khaos reborn as Khaotic!,"['This product is GMO free', 'This product is gluten free', 'This product is allergen free']","Carbonated Water, Sucrose, Juices from Concentrate (10%) (Apple, Orange, Peach, Tangerine, White Grape, Pineapple), Glucose Syrup, Flavourings, Taurine (0.4%), Acids (Citric Acid, Malic Acid), Acidity Regulators (Sodium Citrates, Potassium Citrates), Panax Ginseng Root Extract (0.08%), Preservative (Potassium Sorbate), Caffeine (0.03%), Sweeteners (Sucralose, Steviol Glycosides from Stevia), Vitamins (B3, B6, B2, B12), Colours (Carotenes, Anthocyanins), L-Carnitine L-Tartrate (0.004%), Inositol","['Free From Celery', 'Free From Cereals Containing Gluten', 'Free From Crustaceans', 'Free From Eggs', 'Free From Fish', 'Free From Lupin', 'Free From Milk', 'Free From Molluscs', 'Free From Mustard', 'Free From Nuts', 'Free From Peanuts', 'Free From Sulphur Dioxide/Sulphites', 'Free From Soya', 'Free From Sesame', 'Free From Genetically Modified Ingredients', 'Contains Sweeteners', 'Recycling Info: Recycle Pack', 'Pack Type: Can']",Monster Energy Drink Khaotic,Monster Energy Drink Khaotic 500ml PM 1.75,,False,monster-energy-drink-khaotic
814898-1,Fairy Original Washing Up Liquid Green with LiftAction 320ML,8.09,Grocery > Retail and Professional Cleaners > Washup Liquids,814898.0,320ml × 10 × 1,https://www.bestwaywholesale.co.uk/img/products/250/0/8006540994290.jpg,https://www.bestwaywholesale.co.uk/product/814898-1,814898,£1.29,Fairy,320ml,814898.0,8006540994290.0,Standard,"Every drop of Fairy Washing Up Liquid provides the ultra long lasting cleaning power you expect for your washing up. Its concentrated formula cuts through grease instantly giving you brilliant clean dishes. No wonder Fairy Original Lemon is the gold standard of washing up liquids. Fairy original washing up liquid is so concentrated that you only need to use a drop without efforts: no soaking, no grease, no fuss.","['No soaking, no grease, no fuss', 'Efficient cleaning, cleans greasy leftover food completely', 'Its concentrated formula cuts through grease instantly giving a neat clean', 'Ultra long lasting suds from every drop', 'Smells great with two fresh scents to choose from: the trusted Original scent & Lemon']","5-15% Anionic surfactants,  Non-ionic surfactants; preservatives,  Benzisothiazolinone,  Methylisothiazolinone,  Phenoxyethanol,  Perfumes,  Limonene.","['Country of Origin United Kingdom', 'Packed In United Kingdom', 'Pack Type: Bottle']",Fairy Original Washing Up Liquid Green with Liftaction,Fairy Original Washing Up Liquid Green with LiftAction 320ML,,False,fairy-original-washing-up-liquid-green-with-liftaction
827539-1,Hula Hoops Big Hoops BBQ Beef Crisps 70g 1.35 PMP,15.49,Grocery > Crisps and Snacks > Snack Single Family,827539.0,70g × 20 × 1,https://www.bestwaywholesale.co.uk/img/products/250/2/5000237206072.jpg,https://www.bestwaywholesale.co.uk/product/827539-1,Barbecue Beef Flavour Potato Rings,£1.35,Hula Hoops,70g,827539.0,5000237206065.0,Standard,"Snacks can be enjoyed as part of a balanced diet and healthy lifestyle, including regular exercise.","['Bigger Hoop Bold Flavour', 'Bigger than Standard Sized Hula Hoops', 'No MSG', 'No Artificial Colours', 'No Artificial Flavours', 'Suitable for Vegetarians']","Potato (Dried Potato & Potato Starch), Sunflower Oil, Barbecue Beef Flavour [Rice Flour, Salt, Dried Yeast Extract, Sweet Whey Powder (Milk), Dried Onion, Potassium Chloride, Sugar, Natural Flavouring, Dried Tomato, Maltodextrin, Colour: Paprika Extract], Natural Flavouring (contains Potassium Chloride, Dried Yeast Extract, Salt, Maltodextrin, Dried Onion), Salt","['May Contain Cereals Containing Gluten', 'Contains Milk', 'Free From MSG (Glutamate)', 'Free From Artificial Colours', 'Free From Artificial Flavours', ""Recycling Info: Recycle with bags at large supermarket - Don't recycle at home Pack"", 'Pack Type: Bag']",Hula Hoops Big Hoops Bbq Beef Crisps 1.35 Pmp,Hula Hoops Big Hoops BBQ Beef Crisps 70g 1.35 PMP,,False,hula-hoops-big-hoops-bbq-beef-crisps-135-pmp
827237-1,CocaCola Zero Sugar 12 x 500ml PM 1.40,8.29,Grocery > Soft Drinks > Small Bottles,827237.0,500ml × 12 × 1,https://www.bestwaywholesale.co.uk/img/products/250/9/5017726449339.jpg,https://www.bestwaywholesale.co.uk/product/827237-1,Sparkling Low Calorie Soft Drink with Plant Extracts with Sweeteners.,£1.40,Coca-Cola,500ml,827237.0,5000112684315.0,Standard,"Coca-Cola zero sugar is the legendary flavoured sparkling soft drink, without sugar. Everything about Coca-Cola zero sugar is unique; from its iconic flavour to the famous bottle. This all-time classic is designed with a crisp and unique flavour. But it's not only about the great taste. Coca-Cola zero sugar is so much more.","['Great Coca-Cola taste with zero sugar & zero calories', 'Looks and tastes like Coca-Cola original taste, but without the sugar', 'Coca-Cola Zero Sugar, bringing happiness to fans', 'Happiness, bottled', 'Carbonated beverage', 'Great taste', 'Delicious and refreshing', 'GMO free', 'Added colours', 'Intense sweetners', 'Suitable for Vegans', 'Suitable for Vegetarians']","Carbonated Water, Colour (E150d), Acid (Phosphoric Acid), Sweeteners (Aspartame, Acesulfame-K, Enzymatically Produced Steviol Glycosides), Natural Flavourings, Caffeine Flavouring, Acidity Regulator (Sodium Citrates)","['Free From Celery', 'Free From Cereals Containing Gluten', 'Free From Crustaceans', 'Free From Eggs', 'Free From Fish', 'Free From Lupin', 'Free From Milk', 'Free From Molluscs', 'Free From Mustard', 'Free From Nuts', 'Free From Peanuts', 'Free From Rye', 'Free From Sulphur Dioxide/Sulphites', 'Free From Wheat', 'Free From Barley', 'Free From Oats', 'Free From Soya', 'Free From Sesame', 'Free From Genetically Modified Ingredients', 'Contains Sweeteners', 'Pack Type: Wrap']",Cocacola Zero Sugar,CocaCola Zero Sugar 12 x 500ml PM 1.40,"{'count': 12, 'size': 500.0, 'unit': 'ml', 'format': '12x500ml'}",True,cocacola-zero-sugar
824538-1,Monster Energy Drink Ultra Peachy Keen Zero Sugar 500ml PM 1.65,9.89,Grocery > Soft Drinks > Energy and Health Drinks,824538.0,500ml × 12 × 1,https://www.bestwaywholesale.co.uk/img/products/250/5/5056784900215.jpg,https://www.bestwaywholesale.co.uk/product/824538-1,"Carbonated Peach Flavour Energy Drink with Taurine, Ginseng, Caffeine, L-Carnitine and B Vitamins with Sweeteners",£1.65,Monster Energy,500ml,824538.0,5056784900215.0,Standard,"The summer of love was about hope, peace and connecting to something bigger than yourself. A time of carefree fun, limitless possibilities and believing anyone but the man. So don't take our word for it, check it out for yourself ‘cause it's all good when you're sippin' Ultra Peachy Keen. Zero sugar, juicy flavour and the Monster Energy blend from our secret stash. Everyone from boomers to zoomers is down with that.Unleash the Ultra Beast!","['Taurine + Zero Sugar + L-Carnitine', 'This product is GMO free', 'This product is allergen free', 'This product is gluten free']","Carbonated Water, Acid (Citric Acid), Taurine (0.4%), Acidity Regulator (Sodium Citrates), Maltodextrin, Panax Ginseng Root Extract (0.08%), Flavourings, Preservatives (Potassium Sorbate, Sodium Benzoate), Sweeteners (Sucralose, Acesulfame K), Caffeine (0.03%), Vegetable Oils (Coconut, Rapeseed), L-Carnitine L-Tartrate (0.015%), Modified Starch, Vitamins (B3, B5, B6, B12), Sodium Chloride, Guarana Seed Extract (0.002%) Inositol, Colours (E102, E110)","['Free From Celery', 'Free From Cereals Containing Gluten', 'Free From Crustaceans', 'Free From Eggs', 'Free From Fish', 'Free From Lupin', 'Free From Milk', 'Free From Molluscs', 'Free From Mustard', 'Free From Nuts', 'Free From Peanuts', 'Free From Sulphur Dioxide/Sulphites', 'Free From Soya', 'Free From Sesame', 'Free From Genetically Modified Ingredients', 'Contains Sweeteners', 'Recycling Info: Recycle Pack', 'Pack Type: Can']",Monster Energy Drink Ultra Peachy Keen Zero Sugar,Monster Energy Drink Ultra Peachy Keen Zero Sugar 500ml PM 1.65,,False,monster-energy-drink-ultra-peachy-keen-zero-sugar
823121-1,Boost Isotonic Sport Orange 500ml,6.19,Grocery > Soft Drinks > Energy and Health Drinks,823121.0,500ml × 12 × 1,https://www.bestwaywholesale.co.uk/img/products/250/3/5000382123613.jpg,https://www.bestwaywholesale.co.uk/product/823121-1,"Isotonic Orange Flavour Soft Drink with Added B Vitamins, Sugars and Sweeteners.",£0.89,Boost,500ml,823121.0,5000382123613.0,Standard,"A hydration hit to energise every workout, match or game.Rehydrate. Refuel. Recharge.","['Boost Hydration', 'Boost Performance', 'Added Electrolytes = Enhanced Hydration']","Water, Glucose-Fructose Syrup, Acid (Citric Acid), Acidity Regulator (Sodium Citrate), Antioxidant (Ascorbic Acid), Sweeteners (Aspartame, Acesulfame K), Flavourings, Preservatives (Potassium Sorbate, Dimethyl Dicarbonate), Stabilisers (Acacia Gum, Glycerol Esters of Wood Rosins), Vitamins (Niacin, Pantothenic Acid, Vitamin B6, Vitamin B12), Colour (Beta Carotene)","['Contains Sweeteners', 'Please Recycle Me', 'Please remove sleeve before recycling', 'Pack Type: Plastic Bottle']",Boost Isotonic Sport Orange,Boost Isotonic Sport Orange 500ml,,False,boost-isotonic-sport-orange
,,,,,,,https://www.bestwaywholesale.co.ukNone,,,,,,,,,,,,,,,True,
,,,,,,,https://www.bestwaywholesale.co.ukNone,,,,,,,,,,,,,,,True,
818407-1,Diet Coke 24 x 330ml PM 90p,7.29,Grocery > Soft Drinks > Individual Cans,818407.0,330ml × 24 × 1,https://www.bestwaywholesale.co.uk/img/products/250/2/5017726438432.jpg,https://www.bestwaywholesale.co.uk/product/818407-1,Sparkling Low Calorie Soft Drink with Plant Extracts with Sweeteners,£0.90,Diet Coke,330ml,818407.0,5000112663945.0,Standard,The great refreshing taste of Diet Coke with no sugar and no calories.,"['No sugar and calories', 'This product is GMO free', 'This product is gluten free', 'This product is allergen free', 'This product is suitable for vegetarians/vegans']","Carbonated Water, Colour (Caramel E150d), Sweeteners (Aspartame, Acesulfame K), Natural Flavourings including Caffeine, Acids (Phosphoric Acid, Citric Acid)","['Free From Celery', 'Free From Cereals Containing Gluten', 'Free From Crustaceans', 'Free From Eggs', 'Free From Fish', 'Free From Lupin', 'Free From Milk', 'Free From Molluscs', 'Free From Mustard', 'Free From Nuts', 'Free From Peanuts', 'Free From Sulphur Dioxide/Sulphites', 'Free From Soya', 'Free From Sesame', 'Free From Genetically Modified Ingredients', 'Contains Sweeteners', 'Recycling Info: Metal - Widely Recycled Can', 'Pack Type: Box']",Diet Coke,Diet Coke 24 x 330ml PM 90p,"{'count': 24, 'size': 330.0, 'unit': 'ml', 'format': '24x330ml'}",True,diet-coke
831148-1,Pepsi Max Cherry 500ml,9.49,Grocery > Soft Drinks > Small Bottles,831148.0,500ml × 12 × 1,https://www.bestwaywholesale.co.uk/img/products/full/upl/831148.jpg,https://www.bestwaywholesale.co.uk/product/831148-1,Carbonated Low Calorie Cherry Cola Flavoured Soft Drink with Sweeteners,£1.39,Pepsi,500ml,831148.0,4062139024230.0,Standard,,"['Maximum Taste', 'No Sugar']","Carbonated Water, Colour (E150d), Sweeteners (Aspartame, Acesulfame K), Flavourings (Including Caffeine), Acids (Phosphoric Acid, Citric Acid), Preservative (Potassium Sorbate)","['Contains Sweeteners', 'Country of Origin United Kingdom', 'Recycling Info: Recycle Pack', 'Pack Type: Bottle']",Pepsi Max Cherry,Pepsi Max Cherry 500ml,,False,pepsi-max-cherry
820862-1,Monster Energy Drink Mango Loco 4 x 500ml PM 5.49 ,18.49,Grocery > Soft Drinks > Energy and Health Drinks,820862.0,500ml × 6 × 1,https://www.bestwaywholesale.co.uk/img/products/250/2/5061013942362.jpg,https://www.bestwaywholesale.co.uk/product/820862-1,"Carbonated Fruit Energy Drink with Taurine, Caffeine, L-Carnitine, Inositol and B Vitamins with Sugars and Sweetener.",£5.49,Monster,500ml,820862.0,5061013942362.0,Standard,"On the eve of October 31st each year friends and family gather to celebrate ""Dia de Los Muertos"". Marigolds, mysticism and memories combined with food and drink entice the souls of the departed to join the party. Mango Loco is a heavenly blend of exotic juice flavours certain to attract even the most stubborn spirit. Crazy good taste with just enough of that Monster magic to keep the party going for days…",[],"Carbonated Water, Fruit Juices from Concentrate (15%) (White Grape, Mango, Guava, Apple, Pineapple, Passion Fruit, Apricot, Peach, Orange, Lemon), Sucrose, Glucose Syrup, Acid (Citric Acid), Taurine (0.4%), Acidity Regulators (Potassium Citrates, Sodium Citrates), Flavourings, Maltodextrin, Preservatives (Potassium Sorbate, Sodium Benzoate), Caffeine (0.03%), Vitamins (B3, B6, B2, B12), Stabilisers (Xanthan Gum, Sodium Alginate), Sweetener (Sucralose), L-Carnitine L-Tartrate (0.004%), Sodium Chloride, Inositol (0.002%), Colour (Carotenes), Vegetable Oils (Coconut, Rapeseed), Modified Starch","['Contains Sweeteners', ""Recycling Info: Recycle with bags at large supermarket - Don't recycle at home Pack""]",Monster Energy Drink Mango Loco,Monster Energy Drink Mango Loco 4 x 500ml PM 5.49 ,"{'count': 4, 'size': 500.0, 'unit': 'ml', 'format': '4x500ml'}",True,monster-energy-drink-mango-loco
823093-1,Boost Isotonic Sport Mixed Berry 500ml,6.19,Grocery > Soft Drinks > Energy and Health Drinks,823093.0,500ml × 12 × 1,https://www.bestwaywholesale.co.uk/img/products/250/7/5000382123637.jpg,https://www.bestwaywholesale.co.uk/product/823093-1,"Isotonic Mixed Berry Flavour Soft Drink with Added B Vitamins, Sugars and Sweeteners",£0.89,Boost,500ml,823093.0,5000382123637.0,Standard,"A hydration hit to energise every workout, match or game.Rehydrate. Refuel. Recharge.","['Boost Hydration', 'Boost Performance', 'Added Electrolytes = Enhanced Hydration']","Water, Glucose-Fructose Syrup, Acid (Citric Acid), Acidity Regulator (Sodium Citrate), Vegetable and Plant Concentrates (Carrot and Hibiscus), Flavourings, Preservatives (Dimethyl Dicarbonate, Potassium Sorbate, Sodium Benzoate), Sweeteners (Aspartame, Acesulfame K), Vitamins (Niacin, Pantothenic Acid, Vitamin B6, Vitamin B12)","['Contains Sweeteners', 'Please Recycle Me', 'Please remove sleeve before recycling', 'Pack Type: Plastic Bottle']",Boost Isotonic Sport Mixed Berry,Boost Isotonic Sport Mixed Berry 500ml,,False,boost-isotonic-sport-mixed-berry
823924-1,Red Bull Energy Drink Red Edition 250ml PM 1.65,9.89,Grocery > Soft Drinks > Energy and Health Drinks,823924.0,250ml × 12 × 1,https://www.bestwaywholesale.co.uk/img/products/250/5/90457975.jpg,https://www.bestwaywholesale.co.uk/product/823924-1,Energy Drink with the taste of Watermelon,£1.65,Red Bull,250ml,823924.0,9002490280390.0,Standard,Niacin and vitamin B6 contribute to the reduction of tiredness and fatigue as well as to normal energy-yielding metabolism.,"['Vitalizes body and mind®', 'Pasteurised']","Water, Sucrose, Glucose, Acid (Citric Acid), Carbon Dioxide, Taurine (0.4%), Acidity Regulator (Sodium Citrates), Caffeine (0.03%), Vitamins (Niacin, Pantothenic Acid, B6, B12), Flavourings, Colours (Anthocyanins, Riboflavins)",['Pack Type: Can'],Red Bull Energy Drink Red Edition,Red Bull Energy Drink Red Edition 250ml PM 1.65,,False,red-bull-energy-drink-red-edition
823255-1,Pringles Texas BBQ Sharing Crisps 6 x 165g PMP 2.99,7.89,Grocery > Crisps and Snacks > Tubes,823255.0,165g × 6 × 1,https://www.bestwaywholesale.co.uk/img/products/250/0/5053990178490.jpg,https://www.bestwaywholesale.co.uk/product/823255-1,Texas Barbecue Sauce Flavour Savoury Snack.,£2.99,Pringles,165g,823255.0,5053990178490.0,Standard,,['Suitable for Vegetarians'],"Dehydrated Potatoes, Sunflower Oil,WheatFlour, Corn Flour, Rice Flour, Barbecue Seasoning (Sugar, Lactose {Milk}, Salt, Onion Powder, Flavour Enhancers {Monosodium Glutamate, Disodium 5'-Ribonucleotides}, Tomato Powder, Paprika Powder, Yeast Extract, Flavourings, Smoke Flavourings, Carob Powder, Acidity Regulator {Sodium Diacetate}, Acids {Malic Acid, Citric Acid}, Garlic Powder, Corn Starch, Colour {Paprika Extract}, Maltodextrin), Maltodextrin, Emulsifier (E471), Salt, Colour (Annatto Norbixin)","['Contains Milk', 'Contains Wheat', 'May Contain Soya', 'Recycling Info: Recycle Lid', 'Recycling Info: Recycle Tube', ""Recycling Info: Don't Recycle Seal"", 'See pringles.com/recycle for further recycling guidance', 'Pack Type: Cylinder']",Pringles Texas Bbq Sharing Crisps,Pringles Texas BBQ Sharing Crisps 6 x 165g PMP 2.99,"{'count': 6, 'size': 165.0, 'unit': 'g', 'format': '6x165g'}",True,pringles-texas-bbq-sharing-crisps
812224-1,Vimto 500ml,8.85,Grocery > Soft Drinks > Small Bottles,812224.0,500ml × 12 × 1,https://www.bestwaywholesale.co.uk/img/products/250/2/5010438020582.jpg,https://www.bestwaywholesale.co.uk/product/812224-1,"Mixed fruit juice drink with flavourings, sugar and sweeteners.",£1.25,Vimto,500ml,812224.0,5010438020582.0,Standard,,['Suitable for vegetarians'],"Water, Fruit Juices from Concentrate 5% (Grape, Blackcurrant, Raspberry), Sugar, Acid (Citric Acid), Vimto Flavouring (including Natural Extracts of Fruits, Herbs,Barley Maltand Spices), Colouring Food (Concentrates of Carrot, Hibiscus), Preservatives (Potassium Sorbate, Sodium Benzoate), Natural Flavouring, Antioxidant (Ascorbic Acid), Sweeteners (Sucralose, Acesulfame K), Acidity Regulator (Sodium Citrate)","['Contains Barley', 'Cap On - Recycle', '100% Recyclable', 'Enjoy to the last drop & recycle', 'Pack Type: Plastic Bottle']",Vimto,Vimto 500ml,,False,vimto
819364-1,Irn Bru 2 Litre,6.25,Grocery > Soft Drinks > 2 and 3 Ltr Bottles,819364.0,2Ltr × 6 × 1,https://www.bestwaywholesale.co.uk/img/products/250/1/5000382121831.jpg,https://www.bestwaywholesale.co.uk/product/819364-1,Sparkling Flavoured Soft Drink with Sugar and Sweeteners,£1.69,Irn-Bru,2Ltr,819364.0,5000382121831.0,Standard,Let's just agree it tastes phenomenal!,['Original and Best'],"Carbonated Water, Sugar, Acid (Citric Acid), Flavourings (including Caffeine, Ammonium Ferric Citrate & Quinine), Sweeteners (Aspartame, Acesulfame K), Preservative (E211), Colours (Sunset Yellow FCF, Ponceau 4R)","['Contains Sweeteners', 'Recycling Info: Recycle Pack', 'Please recycle', 'Our bottles and caps are 100% recyclable', 'Pack Type: Plastic Bottle']",Irn Bru 2 Litre,Irn Bru 2 Litre,,False,irn-bru-2-litre
